3,@argirltecture_ jajajajajajaj la desesperación pues loca
3,"una llegada a Trujillo diferente, meditando pensando y mas tarde a disfrutar la solteria"
3,Cristalito me regalo una piedrita bonita y me la olvidé en hco
3,si mal no recuerdo creo este es el último capitulo dónde escucharemos a tanaka kazunari haciendo de ukai
3,Que se junte de nuevo #vozveis
3,"creo que hoy será la primera vez que un viernes llegaré temprano a la u, será porque es la última clase"
3,"@YacoEskenaFans hola chicos, nos pueden seguir para poderles enviar un DM?"
3,"Amis @EzioOlivaFans, el Sáb. estaré en Chimbote x chamba y quiero saber si el chinito bello cantará en evento o privado, para ir"
3,"@IsAlessandra Ale! yo estoy con unos dolores horribles tipo regla jaja,es q paro de aquí para allá me es imposible, pero llevaré frutita."
3,@IvettlyOficial El descanso también es necesario.
3,"BUen día ... Hoy será un miércoles pintado de crema y rojo. Vamos por esos 3 puntos , a dejar todo en la cancha #YdaleU @Universitario"
3,Y desde Suiza 🇨🇭Nadine desea que todos tengan un gran día Miércoles
3,Tu conectado y yo ni te comento porque se que no te aparezco y no lo veras @AbrahamMateoMus
3,Estoy tan cansada que no veré ninguna serie cuando llegue a casa
3,Necesito unas salchipapas ahora mismo
3,"Lo imposible solo tarda un poco mas cada dia puede ser el comienzo de algo maravilloso, es el mañana que tanto t…"
3,Cuando te enamoras de cada flaca que pasa. Chimbote era chevere pero no me quirro ir de trujillo.
3,@nandoperu feliz día!! Pásala bonito en familia. Un abrazo fraterno
3,@Monilict justo hoy tengo la cena de fin de año del trabajo y vine en vestido
3,JUAS ahora dicen que la paja se la van a hacer con Tracer y su novia. Porque siempre se puede caer más bajo aún ¿no?
3,"@luisenrique3365 Jeje. El @TuiteroCrema se perfila para periodista deportivo, pero si la atina le tendré más respeto desde ya."
3,Las Peculiares Riquezas del Norte del Perù.
3,"@TheCR_MAN ¿Se refieren a cierto ínclito lanudo, no? Digo para poner a enfriar las mías."
3,@fiorellaaah @siriuscarlos yo solamente me rio con la página de memes hoteleros porque son muy on point
3,"Perrita Pelusa, en Amazonas, perdió sus cachorros y adoptó (robó) dos gatitos recién nacidos para amamantarlos"
3,hola chicos perdon por no subir videos estube en fermo pero ahora no y a ya subi uno mirenlo
3,Oye si sobretodo eso de trabajar duro! 2017 se viene con grandes cosas! Porque siempre…
3,"Es cuestión de actitud, de perspectiva y circunstancias. Así que buena cara a los momentos malos"
3,Tal parece que murió el embajador ruso en Turquía Violencia engendra violencia: Juan Pablo II
3,"Hola Jefecito @CarlosJRubiofm ya conectada quisiera escuchar ""Simplemente tu"" y ""no podras"" de Cristian Castro @Fansdelaradio"
3,@verdesrosas receta médica? Full pepas y descanso
3,"→ ¡Ya lo sabes, sigue a @Sedapal en sus Redes Sociales! Excelente semana para todos"
3,@YoSoy_Peru la imitadora de Anita Santibañez canta igualito a la original viendo la Final
3,"Por que saben, con ella es la única persona que llegaba a la u y empezaba a hablar de 5h y yo 1D"
3,Shey esta yendo al canal seguro para El gran show y no veré cuentan todos bitches.
3,"Hoy tocan los Fabulosos Cadillacs, SUM 41, Papa Roach, Gondwana, Simple Plan y como 20 bandas masny no estoy ahi"
3,"Que me responda con un ''OK'', es signo patognomónico de que se molestó."
3,Lo unico Navideño que hay en mi casa son las luces del módem
3,Nicole choteando idiotas desde tiempos inmemorables!
3,Con esto de la marcha del orgullo heterosexual ya no sé si puedo comer conchitas en la cebichería
3,"@AlvaMendz tú no más, los otros dos años anteriores yo ya chambeaba saliendo de la u no más"
3,"@GianeRaffo14 hola, te contamos que el incidente que tuvimos con el aspersor ya se solucionó ¡Te esperamos pronto!"
3,"No es feriado el 26 de dic ni el 2 de enero, entonces mremod fútbol sábado y domingo"
3,Ahora mismo quisiera estar echada en la banca de Pisco. De esta forma podría observar el cielo
3,"Yo veía #VBQ por Dani y Pamela, normal que maten a mi otp. Siempre me pasa jajhshdga"
3,Gracias a todos por regalarme sus comentarios a mi columna de hoy. Invaluable obsequio para mí.
3,Se acaba un año muy productivo en memes
3,@chepibolaa ya no puedo tomar - cero alcohol- ayer estuve internada en la clínica como 6 horas.
3,#MeDicenLindoPor mis grandes ojos con pestañas súper pobladas
3,"@yuyacst No te preocupes Yuya, te entendemos. Que te mejores pronto."
3,@sparkielaurenz esta como diciendo.. Dejemne libreee mrdass!! #jiji #sigotriste
3,@ximena_casanova @VGardini25 yo tambieen SIGUE CON EL PACHECO OYE
3,"Fui sincera, supongo que está bien"
3,"Ya viene el niñito jugando entre flores, y los pajaritos de cantan amores"
3,"Ser valiente no consiste en no sentir miedo, sino en sentirlo y aún así continuar adelante."
3,"y @SheyJacobo hacia gestos para yo no voltear y oh sorpresa con quien me encuentro , me encontre a tu nuevo amigui @skparedes"
3,@LuciaLu26 mi mamá me pasó la misma foto y me dijo exactamente lo mismo
3,"puxa, @abocajarroperu como te pasea @JorgeDCG? alli si no eres inquisidor!"
3,"#NavidadenMamáVictoria En la mañana en el tren, en la tarde en el metropolitano #Regalos #Panetón #Niñ@s #CasaHogar #GranMiércoles"
3,@AlejoIgoa la divaza te tiene cansado toda la noche no te deja dormir
3,@zabdilandia no hagan caso yo las conozco y ustedes no son asi
3,El viernes dejo de ver a muchas personas por un buen tiempo y ah la
3,Igual no iré porque estoy más ajustado
3,"Eso de comerme todo solo por navidad y año nuevo es mentira, porque paro comiendo todo el año"
3,"@MrcdsEatWorld Jaja yo mismo estoy diciendo pues. Pa mañana lo tengo listo. Y sí tengo, pero a veces no quisiera tener #LuzClarito"
3,se supone que ya grabaron para mañana no? entonces ya saben quien sera eliminado y por sus caras tal vez sea guerrero
3,@zombiepolares ten cuidadoo a mi mamá le clonaron la tarjeta hace un par de días
3,Amigas normales? Eso que es? Las mias son unas locas toditas *-*
3,"- Hola insomnio, cómo estás? - echale la culpa a la comida - ok"
3,Una breve reseña de quien soy realmente.
3,@VivianDeLaCruzz me pasa exactamente lo mismo
3,"Y pensar que luego de tantos años siempre ha habido una persona que ha pensado igual que yo, la única"
3,"@astrikiss jajajaja fácil,o derrepente ya nos lo cambiaron por uno nuevo"
3,@PanetonDonofrio a un ancianito que no tiene familia y que llevo víveres y todo lo que necesite con la ayuda de personas desinteresadas!
3,y quiero ir de nuevo al Cosmocaixa
3,"@joshmanbc si conoces algún productor que quiera llevarse la obra, que se contacte con nosotros"
3,Mi amor infinito al ser humano que me traiga un desayunito de @McDonalds_PER muero de hambre
3,"El problema d la mayoría d tuiteros es q cuando uno comenta creen q es personal. Nada q ver. Hay vida después del Twitter,"
3,Que yo quiero ser el nido cuando se cansen tus alas.. pequeña sonrisa sonora @manuelcarrasco_ @CarlosJRubiofm @GannyMartin @Fansdelaradio
3,Despierta desde las 7 habiendo dormido a las 4 masomenos y esta vez Sofi no fue la responsable jajajaja
3,"@mariellymc y me responde, a no gracias estoy a dieta jjajajajaja"
3,@di3goc Espero llegar y encontrar esa impresora 3D
3,Todavia no llega el día y ya lo extraño. #MiKevinacho
3,"@katy_mili JAJAJA yo mentiroso jamás amiga, pero ya pz esperare tu inciativa para que me digas franck vamos a perdernos jaja"
3,@luis_2lo cuaaaaal? Estoy en busca de una bonita pero nada me convence
3,"@camilaguimasr y lo sabes , cosas muchas mejores vendrán"
3,Y al noveno día le dije todo a la Marina #Mejorando
3,"Agradece todo, cada momento, cada situación, sea positiva o negativa, ya que la positiva nos hace felices y la negativa nos hace sabios"
3,@FrancescaAgurto recién me conectooooo Juan está enfermo mañana te prometo que te recojo
3,"- Señorita olvidó su bolsa -gracias joven , que puedo hacer por usted ? - avanzar en la fila nada más"
3,Por que soy tan romántico es lo que más quiero cambiar de mi
3,@NiceViolette jajaja me toca discurso el jueves! La próxima te visito
3,Necesito un creador de contenido para mi página ¿Algún interesado?
3,@chifaentiffanys esas son las únicas zapatillas que traen en mi talla al país
3,Ya casi es hora... un nuevo lugar por conocer
3,Soy el único de mi prom que no lloro ...
3,Ojalá todos tuvieran un techo y comida y pasar una buena noche buena
3,Todos terminan aceptando que los mejores técnicos estuvieron del 2006 a 2011 la nueva ministra lo confirma
3,@alexime pero podrías rescatar las cosas buenas que te pasaron ánimos
3,Que pasada... Buen.. día seguir el camino.. dormir todo lo que se pueda ... Éxitos... !!
3,"Suerte que despierto junto a tí, suerte que senti lo que sentí, Suerte que hay más para conocer Suerte que contigo creceré"
3,"Está navidad me la pasare durmiendo, para despertar un 26 relajado"
3,"Lo más probable es que le hable borracha en año nuevo, aprovechando que también es su cumpleaños. Ay"
3,El verano pasado estaba ligerameeente más gordita y la ropa que compré ya no me queda igual
3,mi hermoso @jaime_cruzroman esta que hace live en ig y no puedo ver me quiero morir queria un saludo para las @Cruzers_Peru
3,Esta para unos buenos mates y galletitas
3,"@JosettyHurtado he tenido una lesión en la parte baja de la espalda y no puedo hacer ejercisios,q alternativa tengo para bajar de peso"
3,Un meme de miércoles para un Perú más consciente #EsNiceSi retuiteas #YoCuidoElAgua
3,@laliespos y yo espero que este disponible para los demas paises
3,La única vez que me dormí sin tener sueño y sin ser de noche
3,Y si estoy loco vas a vivir en un manicomio conmigo
3,@DanielUrresti1 no sea malo ... Admita que lo hacen reir de vez en cuando
3,"@edwin una pena, en serio, aún no se saben las causas, verdad?"
3,necesito un hotel barato en trujillo
3,"Y de pronto todo dejo de importarme, y sí, así estuve viviendo feliz"
3,"@amnesico es decir, se estrenó en UVK pero nadie sistematizó taquilla... chamano"
3,"Que lindo el señor Gonzalo,invitandonos pollo a la brasa"
3,"@moniescat @empercutio si, desde aqui se te vé La Fosa de las Bermudas, clarito y con vegetacion"
3,#MiCabalaEs la de mi hno siempre fue correr la primer ola del año para pedirle a Lemanjá olas todo el año
3,@alevar13 me la pasas? Mi playlist feliz necesita actualización
3,#ParaElProximoAñoPrometo ser consecuente con la dieta y el treno @Sr_Pelaez @Studio92 @joannabolona
3,"Escuchando la hora ""hot"" de ""qué paja"" en radio moda"
3,"Ya no puedo la broma de ""estoy embarazada"" por el día de los inocentes."
3,"Sí, ya tomé un decisión y sé que teníamos planes pero mi futuro es primero"
3,@blueHyoMi i lleva mucho sin actualizar? ahora sucede que me enamoro del fic y lo dejan abandonado
3,"@AlvaroThais @Angelpaezs por eso la pregunta es válida... aunque Fuji nos diga ""yuca pa' ti"""
3,Ya acabé mis pendientes pero espero comida que invita la chamba
3,@74evmm callate que esos son mis descargues en la choza jajajaja y aun tienen que esperar otro poquito mas
3,"-hola, quiero pagar la renovación del dni. -el azul? -si jajaja Alto martes señoreeessss!"
3,"@DraMonicaAF noooo, para nada, bueno fuera En serio? Cuanto le quieren cobrar?"
3,@LizzRDavila ayudanos #QueremosERDLalas930pm rt solo rt no des me gusta plis
3,Siempre que estoy triste convierto ese sentimiento en cólera y sólo grito y grito
3,"@val05r acá tienes un excelente abogado Dr Zamorano a sus servicios para el 3, ya que pagan viernes"
3,@catherinecerpa con todas las cremas jajaja tmr tengo hambre jajajsjs
3,@meiermq y mejor seria si le en cuentan a un Ramirez.
3,@tresciente a mí también; no lo he probado como para opinar
3,Camino a casa solo fueron 3 chelas
3,cuando estás conversando de la más tranquila y te hacen recordar que mataron al perro de majin boo
3,@bukanoyt Felices Fiestas Bukano. Que la pases bien.
3,@Artux_Creed #senpainavideño ARTUX ME VOY A BAÑAR SALUDAME!!!! PLISS!!!
3,"@Jimmyenlanada @RobustControl @lito0404 y bueno si me olvido de alguien pues lo lamento, soy mal amigo. Feliz noche."
3,Ahora adelante va ser diferente y a mi modo ..voy ser muy fria ..hasta q te duela ..y te daras cuenta
3,@elhigadodmarita Feliz Navidad Marita... Un fuerte abrazo
3,"@JulyyH18 Bye amigaa pásala bonito y aprende mucho para que de ahí me enseñes jajajaja, espero verte prontito"
3,@catiquinto feliz dia de los inocentes... por otro lado tienes tiempo pa salir
3,Ya quiero empezar a dibujar cuerpos desnudos de mujeres
3,Hoy es el último taller de año
3,te seguiría por twitter pero ya sería demasiado obvio mejor así queda
3,No debería estresarme. No es bueno en mis condiciones
3,Noche de pisco sour + películas con mi flaco
3,cuando escucho everything is awesome recuerdo mis días en 🇨🇿 con el buen Joshua
3,@NaomiViera1 yo no puedo ver su ig story
3,"Él preguntó primero, una solo es educada"
3,Lo mejor es que nunca me doy por vencido
3,No todos son Imeldos navideños en esta época #Imelda #torta #queque #morado…
3,"@chifaentiffanys Fue tu cumpleaños ayer? Ni te había visto activo, jeje. Feliz cumple atrasado"
3,Es casi medio día y ya tengo todo
3,"Mis amigas me preguntaban ¿que te pasa? Y yo les decía estoy re dormida ,SIN DUDAS NECESITABA UN DESPERTADOR"
3,Como regalo de Navidad solo quiero el flotador de unicornio
3,#90FelizNavidad Saludos para todos en especial para mi familia
3,"Alucina. De todos modos, no arruinará mi linda noche buena, a lado de mi fam. @Elicrema"
3,@Vere_MC disculpas aceptadas (chiechie) espero que te haya gustado el regalo si es que ya lo viste.
3,De mi balcón veo pasar pavos horneados y jóvenes horneándose
3,Otra navidad más sin ti mamita maria
3,@Militadq no ayudas ya voy.. y tomo foto para mostrar
3,"@cachetotesrosa pero tranquila, me metió al poro no a donde piensas *maldito corrector*"
3,me olvide de un pequeño detalle y ahora debo ir a Wong
3,#UnLugarEnMiMesa A todas las personas que fueron el mejor respaldo este 2016 Sobre Todo A Ti AMOR
3,"#AsíMeDuela , tendre que comer el pavo , aunque en verano este gordita"
3,Cinco años no son en vano
3,@NoraArcila khaaaa? Ese concierto ha sido más publicitado que la campaña de Keiko... pero... pobreza
3,"@JulianZucchi FELIZ CUMPLEAÑOS JULIAN Z ! q Dios te bendiga muchísimo, un fuerte abrazo desde Huacho"
3,Miraflores dime que dentro de ti hay buenos polos
3,@Madrebeagle jajajaja fui el primer fav de Odín con cotillón
3,Haikyuu debería tener alrededor de 4400 capítulos para vivir feliz hasta los 95 años
3,@chicoretraido Hay dos. Y el pròximo año megaplaza
3,"#2017prometoque recuperare estado fisico, seguire amando y respetando a mi @_adrianaquevedo y veere todos los dias @CombinadoPTV"
3,"Ya déjalo, ya está muerto :v @AlanGarciaPeru @DiarioDeCurwen"
3,@ivonnearce_ y yo a Joel solo lo vi 3 segundos y ni foto tengo
3,y pues bueno seguiremos mirando pelis de terror
3,3 chifas el primero de enero del 2017 bye al cuerpo de 25 años
3,Quiero comer algo rico pero no hay con quien salir #foreveralone
3,Si pues; el daño me lo hago yo mismo
3,No me molestaría si me quieren regalar una camara polaroid ah
3,"El era como un profe de ingles gratis para mi , noooooo #VideoMTV2016 @AbrahamMateoMus"
3,"Despues de muchos años, pudimos reir por un buen par de horas.."
3,Después de algunos años pasaré el año nuevo con mis papás
3,"Tanto ritmo en el restaurant #DonMarcelo Si vienes a #Cusco, no olvides visitarlo @ Plaza de…"
3,@MemesDelPeru tal cual csm @ClaroPeru hazte una y alarga la vigencia del 4G ilimitado
3,Solo que me inviten un almuerzito o dos que me quedo misia
3,Mañana es año nuevo y yo sin planes
3,@_josejones anturio! En el mercado de flores de Barranco
3,@Agustozuloeta con todo. Debe ser un buen 2017. Abrazo
3,"@cachetotesrosa ahora ya estoy un mejor, pero tendré que regresar a la clinica en la semana"
3,@chifaentiffanys no soy emo!!!! … feliz año!!
3,Salí por fin!!!! Ahora a grabar y luego stand up #QuieroUnShilcano
3,"Año nuevo ? Si? En mi cama, durmiendo ."
3,"Como te elicas algo que no viste venir, ¿Cómo?"
3,"Voy a cambiar mi vida, dejaré de salir por un buen tiempo"
3,@Joustinrs asi es la vida del adulto hermanito buenas vibras
3,@ilazo @lorenadcw no tengo catálogo de modelos de polvos azules amiga
3,"@AggroQueenFay Solo fui a una de sus presentaciones 30 minutos, comprendeme"
3,@FotoCalato @cinencuentro gracias por apoyar al cine hecho en las regiones
3,Necesito urgente entrar a la gimnasia y al gimnasioo
3,Lo que me recuerda que @edvergaray me criticará de seguro
2,"Ayer, y le preguntó dónde uno es !!!! Mi grupo levanta la mano y no sólo entregó a mí y toda AJAJAJAJAJJA"
2,"Fin de semana para hacer lo que a uno le hace feliz, en lo que sea, pero esto es lo que uno puede ganar el Rev."
2,"Elegir el amor y el dolor, por lo que parece imposible, por lo que está sacudiendo el alma, así que estaba asustado, por lo que va a hacer daño. transferencias amor"
2,"¿sadalienpotato eligió afeitado? En serio, estoy confundido. (Admito que me corte por aburrimiento, como el 99% de las personas)"
2,squall_drifterPokemonGOespana lo mismo me pasa a mí
2,"Sin dormir, pero ahora la calma porque se tomó la píldora. Este fármaco está indicado por el DTA mí cada 8 horas. Usted será siguuente 08:30"
2,"Las personas que cantan en Río ""Ole Ole Ole Ole, Delpo! Delp!"" Estás delpotrojuan locales, y tomar ventaja de ello y hacerlo lo mejor posible. Pero espero que se olvida"
2,"Vida y donde su implementación debe ser, porque al final todo fue el objeto. Lo que debe ser, ya era"
2,"Veo que echamos de menos ... mi tío nos ha llamado, el hijo de un dedicado tuits mi madre y mi tío me envió una foto con caras tristes, pero cuando hay AH ..."
2,QJorgeCallirgos sensación tremenda ajajaja
2,"Lo haré o no lo haré !!! Destacó pero feliz con el amor, el verdadero amor y la sensación real de que amaba no estaba de acuerdo con M x x comodidad y no hacer"
2,"Incluso subir a la montaña más alta, ya que es ""muy peligroso"", pero el camino estrecho, Omar al-Faruq, quería mi imagen con la antorcha"
2,"Sé que Yixing no da mucha gracia, pero se esfuerza. Cada uno trata de dejarnos unos nuevos memes, pero se esfuerza"
2,"Ese momento cuando no puede dormir y no sé por qué, pero yo estaba sonriendo de oreja a oreja, como todas las semanas"
2,"Me gusta estar solo, y él sentía resentida de las personas que hablan mucho. Si nos juntáramos sólo para escuchar música y de vez en cuando para hablar de ello"
2,"metrokosmiko pero volver a capturar y usted (y bueno, se dice, es mi razón para no ir al gimnasio, por lo que prefieren entrenar en casa)"
2,"Comenzó el comienzo de la tercera y última, que termina mañana a las 07:00. Aire más calor de lo que era hace semanas. Bueno, es primavera!"
2,"Terminé mi Inktober, pero no es mi hermano y yo no puedo esperar para pasar hasta 3 días para levantar uno al otro. Dibuje adivinar!"
2,"Virginia extraña, extraña Liu, echo de menos mis primos, y echo de menos mi tía extraño y ver la nieve, puesta de sol y cervatillos"
2,No sé qué pasa con lo que he estado escuchando la mitad del disco Spotify de los cuales Serge no me deja ninguna declaración. ¿Qué tan bien engatuzan pobres
2,Esto no es bueno bueno para poner una buena cara cuando se sufre o no puede mirar a la cosa espacio Nomas recuerdan a Dios
2,"Mi vida es cada día mejor, para mi gusto, pero para disgusto de muchos, daño XQ no debe molestar a los demás lo que les hace felices"
2,"Estás loco por el sol y la luna me hizo quiero jugar, pero las estadísticas hablan huevadas y esta idea. Estoy feliz nomas caza y lucha"
2,"Hay muchas cosas en mi casa P pituelistas creen lo contrario para mí, y yo no nos llevamos una gruesa suspensión de todos los twitts"
2,"Así FerReynaOFICIAL cansado final de la jajajaajaja años, diciemnre meses con el trabajo duro, pero no hay nada que me detenga, presentado"
2,ZabdielpanamaOF cuenta conmigo todo butírico
2,"Mica para producir un canal de hoy, hermosa! Él nos envió un saludo y dijo que el nuevo Pitu se durmió os y veo ..."
2,Quiero eterna Rose
2,plazaveaomarvch me dio tiempo literal
2,"Puede que no vaya, mis vecinos acaba de encender el tamaño de radio Max sonar primera ""llegooooo cerveceroooooo y caaaaantineroooooo"""
2,"... Sólo googleaba y Read Taringa, entré en diferentes hoy.Y de YouTube gracias a todo lo que soy hoy y I @ microbox6"
2,alimentos Shamans_Blues_ lleva todo el lado negativo y luego buenaso. Gracias !! Que les vaya bien en el último partido de su
2,"Entraron en la oficina y dice: ""Sólo voy a pagar que no vienen con escotes pronunciados."""
2,"Bueno, yo pongo todo de mi parte, el siguiente paso: la ideología de Al Qaeda. Después no me dejan no lo intento. bendecir"
2,"Es raro que seguir dando mis comentarios como octubre, pero me recuerda por qué me pongo"
2,"No voy a decir, porque le duele ambos saben que no desea saber lo que pienso o lo que diga o mis motivos eres realmente bueno para mí"
2,"Hoy será un día de fiesta y el tráfico será menor, igual o mayor que en Lima, aquí vamos con hierro"
2,Quiero una familia como #ModernFamily
2,"Estoy con todos los sentimientos, odio despedida de hoy va a ser muy emocional. La fe de mi último día aquí y los próximos nuevos retos"
2,"Renunció como Luiz limeño tráfico guiarlo, vino y se rompió, Lima y el tráfico del mal jaja"
2,"PonyGaJr Si no parecía algo, que era un extraño .__. Pero se trata de un vídeo, sólo sé que estos dos son cerca uno del otro, así como"
2,"Ahora van a decir que vayamos a cabo en la prueba PISA no es una alianza héroe, y luego dejar solos a compadre"
2,"Su musadorada IP? Bueno, supongo que sí. La conferencia le dará un tipo de certificado. He recibido su nombre completo"
2,"Si su día amargo ""dar un paso"" a veces el azúcar en el fondo."
2,@ Karim0603 ja ja ja ... No insultes a nadie ni cerradura ... actúo Twitter como mi vida normal ...
2,Hasta los últimos consecuecias #Abrahamers #Lealtad
2,"ldpilarevolledo tolerancia Pilu, siempre que no exista la tolerancia de que es mejor o peor para escuchar música frágil frágil frágil frágil frágil"
2,"eunhyukeeprince por eso que tengo un sesgo .. y apoyo a los demás, pero la mayoría del fandom y POS .."
2,"eunhyukeeprince no se preocupe como dije ... ^^ ELF para hacer lo que quiero, y yo simplemente no importan SJ"
2,unforestoYurikitoKSP diciendo que nos hace sentir mejor u jaja ... pero bueno son más jóvenes tiene mucho que ver y hacer. Éxito!
2,"walfon_ Renato sólo sirve para cursitos y jugar un juegos marveleros pocas nota, cocer el pan y el vino que RenatoDelgadoR tquiero"
2,mario_hart mi hermana dice que asegurarse de que no pinto un rubio así que es mejor pensar en ello es
2,"Si sólo #millenials voto, habrá #Brexit, Rajoy no me había reelegido, y que había firmado el acuerdo de paz en Colombia."
2,"No ayer o que determinan el futuro para nosotros, pero lo que hacemos aquí y ahora, donde todo es posible"
2,"Papá: Yo quería ir con usted el bebé clásico, pero el domingo 03:30 juego de nuevo no veo. Lee: Oh mi puerta NOOOO"
2,"PTM pasó serio Rafael !! En cualquier caso, prefiero no involucrarse en este caso"
2,"@ Manu_esu5franmezap Sí, muy diferentes de las células"
2,helados y películas porfa maratón
2,Lo agradable mañana para terminar bailándole a Mami en Otuzco Regina y me abrazo a mí buss porque yo estaba muy asustado
2,"ArandaPuig lo siento si me encontré con arrogancia, pero su respuesta es simplemente errónea. Usted puede pedir lo que quiera."
2,Katie dio JustBloomTeam como en mi Alanstaqram y RT hace dos días los vio juntos
2,Los ex presidentes siempre huyeron #Nadine
2,"¿Estás RenzoMirandaQ jajajajajajajaja racista, Rosado? Blanquecina luego aceptar y distinguir Me negro"
2,lux_obrien lol realmente? Mi paseo o no creo que buena Enós no se usa
2,TatoGI cada cantante y una nueva canción Caray
2,Yo sólo quiero que me mimas
2,Cuando todo es felicidad y el fracaso del sector de disco de los archivos del ordenador portátil y eliminarlos de la tarea y Champa
2,TatoGI defectos años
2,"@ Cornejorugel31 me puedo imaginar el calor que se debe hacer allí, y puedo imaginar el negro"
2,"Creo que se está haciendo para engañarme, y me gustaría eso. Pero algo me dice que no es tan"
2,No se detuvo para pasar las vacaciones de Navidad y dejar que el nuevo año solo fuera de casa
2,La felicidad también IvettlyOficial seguro de algo que sólo buscar en las pequeñas cosas de la vida.
2,Galdos bien y que conocen y como él en un escudo cuando la cuenta de flaco a una multa sin P maldición se extravía
2,Por un momento pensé que era # APEC2016 cada año en Lima y estoy emocionado
2,@ Dnapa'm teniendo plena jarra de ella
2,Quiero decir que es un políticamente incorrecto: Hoy es Viernes ... niiiguiii !!!! #blackfriday
2,Extraño tener Wi-Fi en la tarde y no sólo porque FB Retorcí libre no hablan con nadie
2,Alexis Dios era santo para mí casi llorando y ahora viene a calmar la vida ochenta y después de esto el hombre
2,Comentar mi error por primera vez
2,Pao_vales tiene algo malo ser coqueta
2,_ _ _ ... hola yo quiero. * rodillas Hug *
2,YurikitoKSP usted tiene un amigo que se deriva grandes .... s necesitan que intensificar su nombre
2,"mr_alealejandro era pelo rojo ... ._. ""#YaChau ..."
2,"@ DiceDiego1LopRock hermosa, no no no ... el costo de la obra es estable. Quemar antes? Jajajaja Yara, firmar quema más seguro"
2,ya ha sido re-jajajajja incontrolada
2,JacoboCisneros es Joda y silencioso como un buen chico como usted no debería molestarse en sonreír o envejecer!
2,Mañana quiero juerguear voy a tener que compartir un día de año
2,ron_quintanillabelecastillo jajaja Cuando? Soy super completa
