2,Así que ir al cine y tiene la mala suerte de ver un antiguo con TIPA impactante!
2,FolagoR No estoy teniendo un buen momento ... sus videos me hacen sentir mejor .... en un intento de frustrar favor
2,Nuevo día .. !! Sólo tiene que ir hacia adelante ... A quién le importa
2,@ Darcy_1010 Oh no ARELIIIII.A MMS y añooooos sdfjksf Te extrañamos
2,El mismo éxito con Angie y SR
2,La luna es hermoso y justo a la izquierda sin RTMP celular
2,"NoticiasCNCO y 3, pero Eric saben que no es mi favorito y Joel"
2,"NoticiasCNCO Voy a que todo el mundo, pero #CNCOwner"
2,Recién Jajajja. Me acuerdoo ayer pegado galletaso lol
2,Este punto no tiene mario_hartNicolaPorcella no afectará nada como Diana y perdonar muchos errores como saltarse pasos.
2,"rossangelch Monsefuana, hay que configurarlo. Jajaja. No se puede vivir en paz con un carrete lleno de memes. Te voy a dar consejos."
2,"RicardoMoran no pasar a responder seguro de que es mejor que hacer, besos, pelado"
2,"Oh Dios, he pecado, pero que era el bikini linda y bronce necesidad"
2,"Después a recordar todos los momentos hermosos que no va a volver, me desperté y fui jataso sigo llorando"
2,"Mi noche no está completo si no ve un video blog de la elcholomena, y creo que ni siquiera fue hoy"
2,"#RogueOne estrellas es la única guerra que no me causa que compró acaba de terminar una película, pero sólo quiero volver a verla"
2,Cualquier persona que quiera trabajar tan pronto madrugaaa hdjahsjsf
2,Quiero ir a ver los animales maravillosos antes de salir del panel
2,Ya no se puede decir de 24 pocillos bailaba
2,Mañana tal vez la última reunión de la dirección natura y enero y comenzar Yanbal
2,"Dennis no, no puede cometer los mismos errores, y es el momento de cambiar y nuevos errores"
2,"A pesar de nuestras limitaciones humanas, el Señor quiere trabajar de maneras asombrosas a través de nuestras oraciones .."
2,BryanpinariveraEvaMPTdiegorrc no entro la hoz y el séptimo no es porque no sabemos la dirección de una nueva trilogía
2,"Algún día va a llegar a tiempo, hoy no es el día"
2,No renunciar .. no dé a su vida otro color cuando el sol sale de nuevo .... .. .. lalala
2,No le daría la pantalla de su bola muy en serio
2,"Cada mañana será puteados, un bonito #despedidos vacaciones er Navidad"
2,Incluso ajajajaja putaaa re desesperada
2,MNN en la medida de la final a su favor
2,"Vanina_lee realidad sí. Clark sigue ahí quiero ver en una relación con su personalidad, por lo que no es QQ jaja"
2,"aplicación Snapchat extrañarlo tanto, yo hubiera preferido: repito una y otra vez"
2,"# PapáNoelYoQuiero para volver, pasar ciclos, y lo más importante, los pls mucho dinero y me enseñó la humildad"
2,Siempre he pensado que las cosas sucedieron una buena razón. Regresó. Dejar que esta maravillosa retorno
2,Lol Envidio diego_baca compras: Buenas fiestas Baquita
2,CosmiCLuB Aunque no me gusta ... tienen una noche agradable
2,"La buena noticia es que el próximo año, cada película Fanboys Bombama desaparecer para siempre."
2,Daniel dice qué aquí es que la lluvia es muy fuerte? En Lima gotas caen por sí solos Hahahahahaha
2,25 de diciembre es la fiesta de alquiler de películas especiales de Navidad y Navidad
2,Se oye el ritmo de la composición romántica me suicida
2,degadiana_ErickBrianColon pero no entiendo porque no parece ser del agrado y espero que también me encanta
2,"doalcarcarmen calles de seguros pasearás que viven en Nueva York todas las noches! Bueno, creo que justo antes de dormir Carmen, y descansar un poco!"
2,"Salí de mis dos amigos de la universidad, así que fui a estudiar por la noche y no sé qué extraño"
2,"No sé cómo vamos a estar en el #futbol Copa Libertadores de prepararse bien, la plata no viene solo"
2,brayamqq son las letras de Scheffer !! Q sé que mañana es el día ....
2,"No sé si he exagerado .. no es el fin del mundo, pero necesito beber para pasar todo esto. Tengo que estar tranquilo"
2,"Quería puta máscara vacaciones de Navidad Buquemik, pero todo el mundo pensaba que era un regalo del MRD"
2,lasabesaba una gran oportunidad para nosotros para disfrutar (con @ NaomiZamudio97) de su trabajo ...
2,@ Alvarezvigo12 jajaaja no es cierto jaja son las canciones nomas
2,"barbaycanas Sin embargo, no hubo necesidad de llamar, sabíamos lo que esperábamos, y será el próximo"
2,"Pero lo rico es dormir hasta 9'41 de la mañana, se siente demasiado perezoso"
2,Me elhigadodmarita de agarre en un buen estado de ánimo del año pasado.
2,Gran única verdad es que no termina de conocer a gente. #BuenDiaATodos
2,"Jajaja tecnología Edwin baterías de manera muy caros, al menos, simplemente guardan en los regalos!"
2,El tiempo de Dios siempre tiene la razón. Esperando pacientemente para él trabajar.
2,Cansada y feliz perooooo dolor de cuello
2,La extraña presencia de mi padre junto
2,"cantouchth No me disculpo por ser uno mismo, y esto es una cosa maravillosa, de verdad"
2,@ Kloz234456 al menos no hay tales hombres tontos
2,A sólo dos horas BonitaAngelique Dormire corta que se ven bien
2,skparedesSheyJacobo Este es el primer día de mañana con la fe
2,mrdanterossi bañan la temperatura del cuerpo frío menos agua del océano
2,Las cosas buenas vienen cuando usted no dice ..... Me recierto
2,Incluso en mi trabajo creo que #studio ... solamente
2,"milatuestamarisolmelissacsinparada y extraño, cuando un grupo de skupe"
2,"@ JaquelinR5_rylandlynch jajaj Ojala y contestar el tonto caminará con una resaca, pero bueno"
2,#SOOMPIAWARDS #TeamE al menos no menos de la tercera plaza
2,2 meses que parece una eternidad. Usted no sabe cómo mi querida abuela te extraño
2,Es imposible no ganar peso aquí (comidas Chiclayo)
2,Peluchin y presionando por la devolución de Gigi
2,2017 1er día de entrenamiento ... Esta tabla es lamentablmente PTM es sólo una ilusión #bodytech
2,Hize más sucio de error más adelante .... # VideoMTV2016AbrahamMateoMus pero todo está siempre al enfermita y símbolos expresivos de apoyandotee¡¡¡ amor * * Gigi
2,ha llegado el momento lluviaaaaa vieneeeeela ir a casa y quería más chilcanos
2,"rojozapatito decir adiós a todos, y les un Feliz Año Nuevo del adiós desean"
2,Me llevo Ma_ adrianaquevedo ex pichangas haha ​​jugaron incluso CombinadoPTV #yosupereamiex
2,Veo muy feliz ???? Sepesaron ya? #LaVidaEsCruel
2,"Si ves todas las heridas internas, entonces tal vez usted me entiende"
2,No puedo dejar de escuchar zas! Alguien que me ayude
2,"@ Madame36 populares Martita no puede predecir, comer sopa seca con carapulcra"
2,ayer y pidió que sólo son !!!! Mi grupo levanta la mano y el único que no se volvió a mí y toda AJAJAJAJAJJA
2,"El fin de semana es hacer lo que te hace feliz, lo que sea, pero eso es lo que está ganando el Rev."
2,"Elige al amor y el dolor, por lo que parece imposible, por lo que revuelve el alma, para que tengas temor, y luego ir herido. amor transformado"
2,"¿@sadalienpotato eligió el afeitado? En serio, estoy muy confundido. (Y admito que me corte por aburrimiento, ya que el 99% de las personas)"
2,@squall_drifter @PokemonGOespana lo mismo me pasa a mí
2,"Sin dormir, pero ahora la calma porque tomé la píldora. Este medicamento indicado por el ATD para mí cada 8 horas. El siguuente será a las 8:30 am"
2,"Las personas que cantan en Río ""ole ole ole, Delpo! Delp!"" El Usuario del sitio @delpotrojuan, tomar ventaja de ella y hacer lo mejor. Pero espero que se olvida"
2,"La vida será lugar donde debe ser, porque en última instancia, todo lo que era y es. Y lo que debería ser, era"
2,"Veo que hemos perdido ... mi tío nos llamó, mi primo me dedicado tuits y mi madre me envía fotos con caras tristes AH, pero cuando estuvimos allí ..."
2,Q @JorgeCallirgos horrible sensación ajajaja
2,"Lo haré o no lo haré !!! estresado pero feliz con su amor, un amor verdadero sincero y sentirse amado en desacuerdo m x x conveniencia y no estoy"
2,"Incluso escalado la montaña más alta, ya que ""es muy peligroso"", sólo el camino es estrecho, y quería que mi foto con la llama"
2,"Sé Yixing no se da, muy divertido, pero los esfuerzos. Cada uno tratando de dejarnos con nuevos memes, sino que trata"
2,"En el momento en que no puede dormir y no sé por qué, pero está sonriendo de oreja a oreja, como todas las semanas"
2,Me gusta estar solo y me molesta la gente que habla mucho. Si sólo nos juntáramos para escuchar música y de vez en cuando para hablar de ello
2,"Pero @metrokosmiko se hace cargo y usted (y bueno, se dice, es mi razón para no ir a un gimnasio, así que prefieren entrenar en casa)"
2,"Comenzó la tercera y última vez termina mañana a las 07:00. La atmósfera es más caliente que hace semanas. Bueno, es primavera!"
2,"Terminé mi Inktober, pero mi hermano no es y no puedo esperar para pasar hasta tres días para reunirlos. Creo que dibujar!"
2,"Virginia impar, extraño Leo, echo de menos mis primos, me olvido de mi extraña tía y ver la nieve y puestas de sol y cachorros"
2,No sé qué le pasa a este disco un medio Serge Spotify he estado escuchando y no me dejo ningún tipo de publicidad. Como una mala l engatuzan
2,No es que el bien es bueno para poner una buena cara cuando se sufre o no puede mirar a las nomas algo de espacio y recordar a Dios
2,"Mi vida es cada día mejor, para mi gusto, pero para disgusto de muchos, xq duele no debe preocuparse de lo que otros los hace felices"
2,"¿Estás loco por el sol y la luna me dio ganas de jugar, pero las estadísticas hablan huevadas y esta idea. Me felices que cogen y lucha nomas"
2,Hay muchas cosas en mi casa pituelistas q pensar lo contrario de mí y no puedo densa Para comentar todos los tweets
2,"final jajajaajaja bien cansado de la @FerReynaOFICIAL años, diciemnre meses, con mucho trabajo, pero no hay nada para detenerme, avanzar"
2,@ZabdielpanamaOF cuéntame por Zabdí
2,"Mica para la salida del canal actual, hermosa! Él nos envió un saludo y dijo fresca Pitu se había quedado dormido y te ver ..."
2,Quiero una rosa eterna
2,@plazavea @omarvch hice un tiempo literal
2,"Y no Mensaje Wow, mis vecinos llaman simplemente el volumen máximo de radio y el primer sonido ""cerveceroooooo llegooooo la caaaaantineroooooo"""
2,"... Sólo googleaba y leer mensajes de Taringa, entré hoy.Y a diferencia de Youtube Gracias a todos los que hoy soy como soy @ microbox6"
2,"@Shamans_Blues_ de la comida que se lleva todo el lado negativo, entonces buenaso. Gracias !! Se quiere muy bien en su última"
2,"Ellos entran a la oficina y decir ""Voy a pagar que no vienen con escotes."""
2,"Bueno, puse todo de mi parte, el siguiente paso: la regla de pensamiento. Después no me deja no lo intento. bendecir"
2,"Es raro que se siga dando mis comentarios como en octubre, pero me recuerda por qué me pongo"
2,"No voy a decir, porque le duele ambos saben que no desea saber lo que pienso o lo que diga o mis motivos Eres muy bueno para mí"
2,"Hoy es un día de fiesta y el tráfico será menor, igual o mayor en Lima, aquí vamos con Fe"
2,Quiero una familia como #ModernFamily
2,"Estoy con todos los sentimientos de odio, despedidas y hoy va a ser muy emocional. La fe de mi último día aquí y nuevos retos"
2,"Waze renunció como el tráfico Limeño guiar a él, vino y se cortó, Lima y mala tráfico jaja"
2,"@PonyGaJr si algo parecía, eso fue raro .__. pero es un video, solo saben los dos están juntos y bien"
2,"Ahora van a decir que nos dejó la prueba PISA y ningún campeón alianza y, a continuación, solos a compadre"
2,"@musadorada su IP? Bueno, supongo que sí. Se dará una conferencia y le dará tipo de certificado. Pásame su nombre completo"
2,"Si el día es amargo ""darle una oportunidad"" A veces, el azúcar está en el fondo."
2,@ Karim0603 jajaja ... No insultar a nadie o el bloqueo ... me porto Twitter como mi vida normal ...
2,Hasta los últimos consecuecias #Abrahamers #Lealtad
2,"la tolerancia Pilu @ldpilarevolledo, la tolerancia proporciona nadie es mejor o peor para escuchar música inestable inestable inestable inestable inestable"
2,"@eunhyukeeprince porque tengo mi sesgo .. y el apoyo a otros, pero la mayoría de los aficionados y no pos .."
2,"@eunhyukeeprince no se preocupe como dije ... ^^ ELF puede hacer lo que quiera, yo lo único que importa SJ"
2,@unforesto @YurikitoKSP decir esto que nos hacen sentir mejor uu jaja ... Pero bueno son más jóvenes tienen mucho que ver y hacer. Éxito!
2,"@walfon_ renato sólo se va por alrededor de cursitos y jugar sus pequeños juegos marveleros ps, pan pan y el vino vino @RenatoDelgadoR I tquiero"
2,@mario_hart mi hermana lo que dice para asegurarse de que nunca se pinta rubio así que es mejor pensar en ello es
2,"Si sólo los #millenials votar, sería #Brexit, Rajoy no habría sido reelegido, y que han firmado el acuerdo de paz en Colombia."
2,"No ayer o determinan el futuro, pero lo que hacemos aquí y ahora, donde todo es posible"
2,"Papá: Yo quería ir clásico con usted, bebé, pero el domingo 3:30 de juego y una vez más no veo. Me: Oh noooo Papi"
2,"PTM serio Rafael pasó !! De todos modos, será mejor que no se involucran en este caso"
2,"@ Manu_esu5 @franmezap sí, realmente diferente de células"
2,helado y película porfa maratón
2,¿Qué tan bueno esta mañana era poner fin a bailándole a Mammy en Otuzco y Regina Abrazo el bus de mí porque yo era demasiado miedo
2,"@ArandaPuig lo siento si me encontré con arrogante, sino simplemente respondió a sus declaraciones erróneas. Usted puede pedir lo que quiera."
2,Katy dio @JustBloomTeam como en mi instagram y RT visto juntos hace dos días
2,ex presidentes siempre escapan #Nadine
2,"@RenzoMirandaQ jajajajajajajaja ¿Eres racista, Rosado? Whitey y luego acepta y me discriminan por el negro"
2,"@lux_obrien lol realmente? Mi no camino o bueno, creo que no se puede utilizar la eNOS"
2,@TatoGI cada cantante y Caray nueva canción
2,Sólo quiero que me Mime
2,Cuando todo es felicidad y un sector falla el disco de la computadora portátil y los archivos se eliminan de Chamba
2,@TatoGI años Fallas
2,"@ Cornejorugel31 puedo imaginar el calor que debe estar haciendo allí, puedo imaginar negro"
2,"Creo que está haciendo un farol mí, aquellos que lo haría. Pero algo me dice que no es tan"
2,Nunca deja de pasar la Navidad y Año Nuevo y mucho menos fuera de casa
2,La felicidad @IvettlyOficial es también una cosa segura que sólo tiene que buscar las pequeñas cosas de la vida.
2,Galdos bien y q saben y les gusta cuando se dara cuenta delgados para su buena q ni puta perdida
2,Por un momento pensé que era # APEC2016 cada año en Lima y me emocioné
2,@ Dnapa'm que lleva un cántaro lleno de sí mismo
2,Me refiero a una frase políticamente incorrecto: Hoy es Viernes ... niiiguiii !!!! #Viernes negro
2,Extraño tener Wi-Fi por la noche y no sólo tienen fb y wa libre porque no hablo con nadie
2,Alexis Dios santo me tenía casi llorando y ahora viene a calmar ochenta vidas después de este chico
2,Para comentar mi culpa por la primera
2,@Pao_vales no tiene nada de malo ser coqueta
2,_ _ _ _ ... Hola quiero. * Las rodillas Hug *
2,@YurikitoKSP tiene un amigo que atrae a gran .... que es lo que necesita paso su nombre
2,"@mr_alealejandro yo tenía el pelo rojo ... ._. ""#YaChau ..."
2,"@ DiceDiego1 @LopRock Ohhh no no no ... es el costo de trabajo estable. quemadura pre? Jajajaja Yara, firmo para quemar más seguro"
2,Fue re jajajajja incontrolada
2,"@JacoboCisneros es Joda, absolutamente un buen chico como usted no debe preocuparse sonreír o más!"
2,Mañana quiero juerguear será mi último año de maratón
2,@ron_quintanilla @belecastillo jajaja cuando? Soy super completa
2,Después de ir al cine y tienes la mala suerte de ver un ex con un TIPA horrible!
2,@FolagoR No estoy teniendo un buen momento ... Sus videos me hacen sentir mejor .... Trate de hacer que falle favor
2,Nuevo día..!! Sólo tiene que ir hacia adelante a quién le importa ...
2,@ Darcy_1010 Oh no mms ARELIIIII.A los añooooos sdfjksf que faltan
2,el mismo paso con Angie y SR
2,La luna es hermoso y justo a la izquierda sin RTMP celular
2,"@NoticiasCNCO y 3, pero Erick saben que no es mi favorito y Joel"
2,@NoticiasCNCO sólo voy a ser #CNCOwner pero todo su opinión
2,Jajajja recientemente. Me acuerdoo ayer me quedé un galletaso lol
2,@mario_hart @NicolaPorcella este punto no ha afectado nada como Diana fue perdonado muchos defectos como saltarse los pasos.
2,"@rossangelch Monsefuana, hay que configurarlo. Jajaja. No se puede vivir en paz con el carrete lleno de memes. Te daré las puntas."
2,"No @RicardoMoran pasar a responder seguros tienen mejores cosas que hacer, besos peladas"
2,"Oh Dios, he pecado, pero eso fue re hermosa y necesaria bronceador bikini"
2,"Después de ellos, recordar todos los momentos hermosos que no va a volver, me desperté y jataso izquierda y sigo llorando"
2,"Mi noche no es completa si no veo la @elcholomena vlog, creo que no subió hoy"
2,"#RogueOne es la única película de Star Wars no tomo me compró acaba de terminar, pero sólo quiero volver a verla"
2,Ambos querían trabajar pronto como madrugaaa hdjahsjsf
2,Y yo quiero ir a ver animales fantásticos antes de salir de la cartelera
2,Ya no se puede decir 24 bien bailaba
2,Mañana es posiblemente la última reunión de la dirección Natura y enero y empezar a Yanbal
2,"Dennis No, no puede cometer los mismos errores, es el momento de cambiar y hacer nuevos errores"
2,"A pesar de nuestras limitaciones humanas, el Señor quiere trabajar de manera asombrosa a través de nuestras oraciones .."
2,@Bryanpinarivera @EvaMPT @diegorrc No voy a entrar en Machete y VII no porque no sabemos la dirección de la nueva trilogía
2,"Algún día voy a llegar a tiempo, hoy no es el día"
2,No renunciar .. no dé a su vida otro color cuando el sol sale de nuevo .... .. .. lalala
2,Yo no le daría una fuerte presión de la pantalla
2,"Todos seamos puteados días, buenas Navidad eh #despedidos"
2,incluso un ajajajaja putaaa está desesperado
2,MNN lo bien su última
2,"@Vanina_lee realidad sí. Clarke todavía no veo q ver con su carácter, entonces no q jaja"
2,"Repito una vez más: Snapchat muchos lo pierdas, que era mi aplicación favorita"
2,"# PapáNoelYoQuiero pass back ciclos, y lo más importante, los pls mucho dinero y me enseña la humildad"
2,Siempre pensé que las cosas suceden por una razón y el buen sucedido. El volvió. Deje que este magnífico retorno
2,lol Envidio @diego_baca pd: Felices Vacaciones Baquita
2,@CosmiCLuB aunque odio ... Tener una buena noche
2,La buena noticia es que el próximo año todos los fanboys Bombama desaparecer para siempre.
2,Daniel dice aquí es que la lluvia y tan fuerte? En Lima gotitas solos caen hahahahahaha
2,25o de diciembre es Navidad y para las películas especiales de Navidad
2,Escuchar ritmo romántica me va a hacer suicidio
2,@degadiana_ @ErickBrianColon pero no entiendo por qué no suena como espero que les guste Me encanta
2,"@doalcarcarmen pasearás asegurar un calles vivas de Nueva York todas las noches! Bueno, creo que sólo Goodnight Carmen, a descansar!"
2,"Salí de mis dos amigos de la universidad, así que fui a estudiar por la noche y no se como la extraña"
2,"No sé cómo vamos a estar en la Copa Libertadores #futbol prepararse bien, la plata no está solo"
2,@brayamqq es chevre letras !! q sepa que mañana es el día ....
2,"No sé si he exagerado .. no es el fin del mundo, pero necesito una bebida para pasar todo. Tengo que estar tranquilo"
2,"Quería para Navidad Buckethead puta máscara, pero todo el mundo piensa que es un regalo de MRD"
2,@lasabesaba una gran oportunidad para nosotros para disfrutar (con @ NaomiZamudio97) de su trabajo ...
2,@ Alvarezvigo12 jajaaja jaja no es real son nomas canciones
2,"@barbaycanas es que no hubo necesidad de llamar, sabíamos qué esperar, el próximo"
2,"Pero lo rico es dormir hasta 9'41 de la mañana, se siente tan perezoso"
2,Me @elhigadodmarita agarran en un buen estado de ánimo del año pasado.
2,La única verdad es que no terminas de conocer gente. #Buenos días a todos
2,"jajaja @edwin tecnología de las baterías son muy caros, regalos, al menos, que acaba de guardar!"
2,El tiempo de Dios siempre tiene la razón; esperando pacientemente para él actuar.
2,Cansada y feliz perooooo dolor de garganta
2,Extraño tener a mis padres juntos
2,"@cantouchth no disculparse por ser uno mismo, eso es genial, realmente"
2,@ Kloz234456 Al menos no hay tonto como estos chicos
2,@BonitaAngelique Dormire sólo dos horitas que me veo bien me
2,@skparedes @SheyJacobo y que es el primer día de mañana con la fe
2,@mrdanterossi baño de agua fría hasta que su temperatura corporal es inferior a la ambiente
2,Y las cosas buenas llegan cuando usted no dice ..... Me recierto
2,Incluso en mi trabajo #studio ... Creo que soy el único
2,"@milatuesta @marisolmelissac @sinparada El desconocido, cuando un grupo skupe"
2,"@ JaquelinR5_ @rylandlynch jajaj Ojala y contestar el tonto caminará con una resaca, pero bueno"
2,#SOOMPIAWARDS #TeamE al menos no tercio inferior
2,Dos meses parecen una eternidad. Usted no sabe cómo mi querida abuela te extraño
2,Imposible no ganar peso aquí (Chiclayo y comidas)
2,Peluchin y urgente para volver gigi
2,2017 1er día de entrenamiento ... Este calendario es lamentablmente PTM es sólo una ilusión #bodytech
2,hize mal sucio tarde .... # VideoMTV2016 @AbrahamMateoMus pero todo siempre tan enfermita y amor emoji apoyandotee¡¡¡ * * Jiji
2,lluviaaaaa vieneeeeela Es hora de volver a casa y quería más chilcanos
2,"@rojozapatito decir adiós a todos, les deseo feliz año nuevo y adiós"
2,Me llevo bien con ex - @ _ adrianaquevedo jaja pichangas incluso jugado @CombinadoPTV #yosupereamiex
2,Veo muy feliz ???? Sepesaron ya? #LaVidaEsCruel
2,Y si has visto todas las heridas internas tal vez entonces usted me entiende
2,No puedo dejar de escuchar zas! alguien que me ayude
2,"@ Madame36 Martita mi gente es impredecible, comer sopa seca con carapulcra"
2,ayer y pidió que sólo son !!!! mi grupo levanta la mano y el único que no me y todos AJAJAJAJAJJA
2,"El fin de semana es hacer lo que te hace feliz, pero todo lo que podía ganar el reverendo"
2,"Elige al amor y el dolor, por lo que parece imposible, se agita el alma, para que usted tiene miedo, y luego ir a doler. amor transforma"
2,"¿@sadalienpotato eligió el afeitado? En serio, estoy muy confundido. (Y tengo que admitir que me corte el aburrimiento, ya que el 99% de las personas)"
2,@squall_drifter @PokemonGOespana lo mismo me pasa a mí
2,"Sin dormir, pero tranquilo porque ahora tomé la píldora. Está indicado por el DTA mí cada 8 horas. El siguuente será a las 8:30 am"
2,"La gente coreaba en Río ""de ole ole ole, Delpo! Delp! ""Usted es @delpotrojuan locales, disfrutar de ella y hacer lo mejor. Pero esperamos que se olvida"
2,"La vida será llegar a donde tiene que estar, porque al final todo lo que era y es. Y lo que es ser, que ya estaba"
2,"Veo que echamos de menos ... mi tío nos llamó, mi prima dedicada tuits mí y mi madre me envió la foto con caras tristes AH pero cuando hay ..."
2,Q terrible sensación de ajajaja
2,"Yo quiero o lo haré !!! pero subrayó satisfecho con su amor, un amor verdadero y sincero sentimiento de ser amado a ningún acuerdo m x x conveniencia y no estoy"
2,"Incluso escalado la montaña más alta porque ""es muy peligroso"", el camino es estrecho, ay, yo quería mi imagen con la llama"
2,"Sé Yixing no se le da mucha divertidos, pero los esfuerzos. Cada intento de dejar con nuevos memes, sino que trata"
2,"Esta vez no puede dormir y no sé por qué, pero usted está sonriendo de oreja a oreja como cada semana"
2,Me gusta estar solo y quiero que la gente que habla mucho. Si sólo nos juntáramos a escuchar música y de vez en cuando para hablar
2,"Pero @metrokosmiko nuevas tomas y que (así, se dice, es mi razón para no ir a un gimnasio, así que prefieren entrenar en casa)"
2,"Comenzó la tercera y última ronda, que termina mañana a las 7 am. El ambiente es más cálidas allí casi todas las semanas. Bueno, es primavera!"
2,"Terminé mi Inktober, pero mi hermano no es y no puedo esperar para pasar hasta 3 días para criarlos juntos. Guess dibujar!"
2,"Virginia extraña, extraña Leo, echo de menos mis primos, me olvido de mi extraña tía y ver la nieve y las puestas de sol y cervatillos"
2,No sé lo que es con lo que yo escuché unidad de sarga medio spotify y me dejó sin publicidad. Qué pobre del engatuzan
2,No es que el bien es bueno para poner una buena cara cuando se sufre o no puede ver algo de espacio nomas y recuerda a Dios
2,"Mi vida es cada día mejor, para mi gusto, pero la gran disgusto de muchos, mal XQ no debe molestar a los demás lo que les hace feliz"
2,"Usted sol y la luna loca me dieron ganas de jugar, pero las estadísticas hablan huevadas y esta idea. I prefecturas felices y captura de defensa"
2,hay muchos en mi casa pituelistas q piensa lo contrario para mí y no estoy densa a comentar sobre todos los tweets
2,"final así @FerReynaOFICIAL de jajajaajaja cansado del año, mes diciemnre con el trabajo duro, pero no hay nada que me detenga, stand"
2,@ZabdielpanamaOF cuenta conmigo Todo por Zabdí
2,"Mica hoy a la salida del canal, hermosa! Él nos envió un saludo y dijo fresca Pitu estaba dormido, y veo ..."
2,Quiero rosa eterna
2,@plazavea @omarvch hice un tiempo literal
2,"Y no publicar wow, mis vecinos están recurriendo únicamente en el volumen máximo de radio y el primer reconocimiento ""cerveceroooooo llegooooo la caaaaantineroooooo"""
2,"... Sólo googleaba y leer los mensajes de Taringa, ingresó hoy.Y diferente Youtube Gracias a todo lo que soy hoy estoy @ microbox6"
2,"@Shamans_Blues_ alimentos se lleva todo el lado negativo, buenaso. Gracias !! Realmente ir bien en su última"
2,"Entran en la oficina y dicen, ""Voy a pagar que no viene con escotes pronunciados. """
