2,@JustBloomTeam Katy le dió like en instagram y en mis Rt hace dos días los vieron juntos
2,Siempre se fugan los ex presidentes #Nadine
2,"@RenzoMirandaQ JAJAJAJAJAJAJAJA ¿estás racista, Rosado? Blanquito y todo te acepto, así me discrimines por negra"
2,@lux_obrien jajaja enserio? a mi no me anda o bueno creo que no la se usar nose
2,@TatoGI cada cantante y canción nueva caray
2,Yo solo quiero que me engria
2,Cuando todo es felicidad y falla un sector del disco de la laptop y se borran archivos muy importantes de la chamba
2,@TatoGI los años no pasan en vano
2,"@cornejorugel31 ya me imagino su calor que debe estar haciendo allá, ya me imagino negra"
2,"Me gustaría pensar que me están haciendo un bluffing, de esos que yo haría. Pero algo me dice que no es así"
2,Jamas dejare de pasar una navidad y mucho menos un año nuevo fuera de casa
2,@IvettlyOficial La felicidad también es algo seguro solo debemos buscarla en las pequeñas cosas de la vida.
2,Buena Galdos y eso q la conoces y te cae bien cuando se dara cuenta la flaca por su bien sin joda q va por mal camino
2,Por un momento pensé que #APEC2016 era todos los años en Lima y ya estaba emocionado
2,@dnapa estoy tomándome un jarro REPLETO de eso
2,Tengo ganas de decir una frase políticamente incorrecta: Hoy es... viernes niiiguiii!!!! #blackfriday
2,Extraño tener WiFi en las noches y no solo tener fb y wa gratis porque no hablo con nadie
2,Dios santo alexis me ha tenido casi llorando y ahora viene a calmarme ochenta vidas después este chico
2,Mi culpa por comentarle en primer lugar
2,@Pao_vales no tiene nada de malo ser coquetos
2,_ Hola _ _ ... _ La quiero. *Un abrazo a las rodillas*
2,@YurikitoKSP tengo una amiga que dibuja genial.... s necesitas te paso su nombre
2,"@mr_alealejandro yo tuve el pelo rojo … ._."" #YaChau …"
2,"@DiceDiego1 @LopRock Ohhh ño ño ño ... Es el costo de trabajar estable. Pre quema? Jajajaja yara, me apunto para la quema más seguro"
2,Ya estuviera re descontrolado jajajajja
2,"@JacoboCisneros es Joda, tranquilo un chico tan simpático como tu no debería molestarse sonrie o envejeceras !"
2,"Mañana quiero juerguear, será mi última juerga del año"
2,@ron_quintanilla @belecastillo jajajaja cuando? Estoy súper full
2,Eso de que vas al cine y tienes la mala suerte de ver a un ex con una tipa horrorosa!
2,@FolagoR no la estoy pasando bien... Tus vídeos me harán sentir mejor.... Trata de hacer más fail please
2,Nuevo día..!! Sólo seguir para adelante que más da...
2,@Darcy_1010 ay no mms ARELIIIII.A los añooooos sdfjksf te extraño we
2,lo mismo pasaremos con Angie y SR
2,La luna está hermosa y justo salí sin celular ptmr
2,@NoticiasCNCO ya conozco a 3 pero Erick que es mi favorito no y Joel
2,@NoticiasCNCO yo solo sere #CNCOwner pero cada quien su opinion
2,Jajajja recién. Me acuerdoo que ayer me metieron un galletaso jajaja
2,@mario_hart @NicolaPorcella ese punto no afecto nada igual a Diana se le perdono varias faltas como saltarse los escalones.
2,"@rossangelch Monsefuana, tienes que configurar eso. Jajajaja. No se puede vivir en paz con el carrete lleno de memes. Te daré los tips."
2,"@RicardoMoran no te gastes en responder de seguro tienes mejores cosas que hacer, besos pelado"
2,"Ay Dios he pecado, pero es que ese bikini estaba re lindo y necesitaba bronceador"
2,"Luego de hacerles recordar todos los bellos momentos que no volverán, me quede jataso ya desperté y sigo llorando"
2,"Mi noche no está completa si no veo el vlog de @elcholomena , creo que no subió hoy"
2,"#RogueOne es la única película de Star Wars que no me ha provocado comprármela apenas terminó, pero igual quiero volverla a ver"
2,"Tanto quería trabajar, madruga pues madrugaaa hdjahsjsf"
2,Quiero y tengo que ir a ver animales fantásticos antes que salga de cartelera
2,Ya no podrá decir 24 bien bailados
2,"Mañana es, posiblemente, el último encuentro de Natura que dirija y Enero ya empezar en Yanbal"
2,"No Dennis, no puedes cometer los mismo errores, es hora de cambiar y cometer nuevos errores"
2,"A pesar de nuestras limitaciones humanas, el Señor quiere obrar de maneras asombrosas a través de nuestras oraciones.."
2,@Bryanpinarivera @EvaMPT @diegorrc el I no entra en el Machete y el VII tampoco porque aún no se sabe el rumbo de la nueva trilogía
2,"Algún día seré puntual, hoy NO es el día"
2,"No te rindas no.. dale a tu vida otro color, siempre sale el Sol.. una vez más.... lalala.."
2,Yo no quise hacerle screen a su snap en serio
2,"Todos vamos a ser puteados mañana, bonita Navidad eh #despedidos"
2,aunque sea una putaaa ajajajaja re desesperado
2,Lo bueno que mñn acaba sus finales
2,"@Vanina_lee en realidad si. Clarke aun esta ahi quiero ver q hacen con su personaje, asi q no se q hacer haha"
2,"Vuelvo y repito y reitero: extraño mucho snapchat, era mi app favorita"
2,"#PapáNoelYoQuiero que regrese, pasar los ciclos, y lo más importante, dinero pls ya mucho me enseñas la humildad"
2,"Siempre he pensado que las cosas pasan por algo y bueno, pasó. Volvió. Hagamos ese regreso magnífico"
2,@diego_baca jajaja te envidio pd: Felices Fiestas Baquita
2,@CosmiCLuB aunque lo odies... Que tengas una linda noche
2,Lo bueno es que el próximo año todos los fanboys de Bombama desaparecerán para siempre.
2,Daniel dice por qué aquí hay esa lluvia así tan fuerte? En lima solo caen gotitas JAJAJAJAJAJAJA
2,El 25 de diciembre es para ver películas navideñas y especiales de navidad
2,Escuchar ritmo romántica va a hacer que me suicide
2,@degadiana_ @ErickBrianColon pero no entiendo porque no tiene sonido igual espero que te haya gustado Yo tambien lo amo
2,"@doalcarcarmen de seguro pasearás por las vivas calles de New York cada noche! Bueno solo supongo Buenas noches Carmen, que descanses!"
2,Me alejé tanto de mis amigas de la universidad por lo que me fui a estudiar de noche y no saben cuánto las extraño
2,"No quiero saber cómo quedaremos en la copa libertadores #futbol a prepararse bien, la plata no llega sola"
2,"@brayamqq es chevre las letras!! sabes q dia es mañana,...."
2,No sé si soy exagerada.. no es el fin del mundo pero yo necesito un trago para pasar todo esto. Necesito estar tranquila
2,"Yo quería para navidad la jodida mascara de Buckethead, pero todos piensan que es un regalo de mrd"
2,@lasabesaba una gran oportunidad para que disfrutemos (con @NaomiZamudio97 ) de su trabajo...
2,@alvarezvigo12 jajaaja no es real jaja son canciones nomas
2,"@barbaycanas es que ya no era necesario llamar ,ya sabiamos lo que espera ,la proxima sera"
2,"Pero qué rico es dormir hasta las 9'41 am , te sientes tan vago"
2,@elhigadodmarita me agarran de buen humor por fin de año.
2,"La única gran verdad, es que no terminas de conocer a las personas. #BuenDiaATodos"
2,@edwin jajajaja con tanta tecnología las pilas salen caras por lo menos te ahorraste en regalos!
2,El tiempo de Dios es siempre correcto; espera con paciencia que Él actúe.
2,Cansada y con dolor de cuello perooooo contenta
2,Extraño tener a mis padres juntos
2,"@cantouchth no te disculpes por ser tú misma, eso está genial, en serio"
2,@Kloz234456 Al menos no quedan en ridículo como estos dudes
2,@BonitaAngelique solo dormire dos horitas bueno yo me lo busque
2,"@skparedes @SheyJacobo y eso que es el primer dia , mañana con fe"
2,@mrdanterossi báñate con agua fría para que la temperatura de tu cuerpo sea menor que la del ambiente
2,Y bueno las cosas llegan cuando no las dices..... recierto
2,Aún en mi #studio trabajando... soy el único creo
2,"@milatuesta @marisolmelissac @sinparada Las extraño, cuando un skupe grupal"
2,@JaquelinR5_ @rylandlynch jajaj ojala y conteste el pendejo andará con una resaca pero de las buenas
2,#SOOMPIAWARDS #TeamE que al menos no bajen del tercer lugar
2,2 meses que parecen una eternidad. no sabes como me haces falta mi querida abuelita
2,Imposible no subir de peso aquí ( Chiclayo y sus comidas )
2,Que vuelvan peluchin y gigi urgente
2,1er día del 2017 entrenando... Este horario es de ptm lamentablmente sólo es una ilusión #bodytech
2,Hize mal en bañarme tarde.... #VideoMTV2016 @AbrahamMateoMus pero asi enfermita y todo siempre apoyandotee¡¡¡ *emoji enamorado* jiji
2,"Se vieneeeeela lluviaaaaa, es hora de ir a casa y yo que quería más chilcanos"
2,"@rojozapatito despídete de todos, deséales feliz año y bye bye"
2,me llevo bien con los ex de @_adrianaquevedo jaja hasta jugamos pichangas @CombinadoPTV #yosupereamiex
2,Los veo muy felices???? Ya sepesaron? #LaVidaEsCruel
2,Y si vieras todas las heridas internas quizás entonces me entiendas
2,no puedo dejar de escuchar wham! alguien ayúdeme
2,"@Madame36 Martita mi pueblo es impredecible, coma sopa seca con carapulcra"
3,"@Fiorela_Gue aw ! recién veo esto, sorrry ! tu pues me dices algo y luego queda en nada vamos hoy a la reu de mi prima? le dije a Mari"
3,"+Saliste ayer? -No, me quedé en casa. +Qué aburrido te has vuelto! -Eso no dices cuando llega la quincena y no tienes ni para el pasaje."
3,"es el tercer día de clases, ya tengo 4 tns de tarea, no he instalado ningún software y acabo de despertar de una siesta de 7 horas"
3,"@BartanSoo12 Pero tú ya sabes por qué le digo así a Yixing ya sé que no es feo (?) HDKSJSKSKS Y SI ME HA PASADO LO MISMO, KYUNGSOO BEBÉ"
3,"Un chico de mi universidad se me acercó y me dijo tienes unos ojos y unas pestañas bien bonitas, solo atine a decir gracias y me fui rojo"
3,"@Rosa_Forno Tejida en técnica de crochet (Sólo tejida con las manos - ""Mi dedo es un Crochet"") Tiempo Récord de ejecución: 3 horas..!!!"
3,"Tengo 4 horas de ""webin"" y ni idea de qué hacer  Aquí no puedo poner música a lo fiesta patronal como con Sarita o Max"
3,"@gaston_acurio 'Francamente' QUÉ?... Vamos, no a todos (ni todo el tiempo) nos tiene que parecer perfecto cada cosa que Ud. hace o dice."
3,"@strikesmarano nop, solo consta de 4 canciones, asi que fue un ep. Yo queria klss your self completa WE MISS THE A&A CAST"
3,"@adorkblelaura Ross gano, laura no, a&a no Laia presento un premio, hay una foto de ross y laura. las huevonas del fandom hacen bardo"
3,@SalvatoreCaro siiiiiii justo te iba a escribir !!!!! Ni modo así suceden las cosas.... Siguiente semana a mi regreso de #Rio2016 !!!!
3,"@Trovack somos dos! jaja ahora eres Martín? oye voy para Lima el prox mes, para el reencuentro d la u, avisas si estarás por esos días"
3,"Empieza la semana con la ilusión de saber que va a ser mágica, llena de momentos felices, sonrisas, miradas y mucho amor. Que así sea"
3,"Se suspendió por fuerza mayor mi show en la mina, y ahora qué hago justo el 28 ya se iré al cambio de mando y haré de Ollanta"
3,"Por lo bonito, lo feliz y lo que hace ilusión. Porque son más las alegrías y ojalá siempre sea así. Porque cada día sea un gran día"
3,@GianSesarego son diferentes carreras pues
3,@ajamaica empezando Python con @platzi emocionada
3,@soleyvelez @CarlosJRubiofm @Fansdelaradio @madshila mañana 2° recordatorio subliminal #OigoFanatica
3,"Toda historia de amor tiene un final feliz, si no eres feliz en este momento debe ser porque no era amor o porque aún no es el final"
3,"Lucero no se vaaaa no se vaaaa, no se vaaaa, Lucero no se va. mañana es el último día de trabajo de una amiga en la chamba."
3,"- Amor, ¿vamos a ver la vida secreta de tus muscotas? - Hoy no puedo BB - No tienes dinero no? - No - Misio de mierda."
3,"Solo tengo que decir estés dónde estés, estés con quién estés, aún te extraño... extraño que me revientes el hígado, oh, pisco amigo mío."
3,"Y algunos escarchados me falta un rosado, un morado, un celeste, un violeta, un marron, un crema, un griss, y mas .."
3,Hace un año he egresado como bachiller y estoy a un par de meses de un año de ser licenciado. ¡Y ES SÁBADO! Acá pes redactando.
3,Tengo prohibido decir NO
3,"Salgo con el chinarrin,su flaca y mi mejor amiga a tomar por el centro y en vez de que mi amiga termine picada,yo termino bailando cumbia"
3,-Amor 1:02 : Acabo de ver a mi hermana con su pretendiente -Camila Díaz 1:03 : uyyy no te exhaltes es normal jaja -Amor 1:04:Casi le pego
3,Regunion familiar en Huanchaquitoooo #siempreunidoslosquierograciasportodoo
3,"Ponerme a pensar en el producto nuevo, el terminar lo de capsaicina, preparar lo que endré en el Poster, y todo lo q debo hacer mañana"
3,@ceciliarvl Fue una vil trampa
3,"ayer me dio mi dio mi ataque de panico retrocedi a cuando tenia 5 años, me despertaba sola en cama y comenzaba a gritar pq no habia nadie"
3,"voy a salir a comprar mayolicas y acabados a habich, veamos q sucede en el camino, la gente buena celulares prendidos porfavor, 3, 2 ,1"
3,@discolocontilde oye pero es carbohidrato
3,"Los problemas no son eternos, siempre tienen solución. La vida es corta, por eso ama, se feliz, siempre se sonríe, vive intensamente"
3,@IvanAndres2410 traete vinito y yaaaa
3,"@Sheo_series creo que si, ella no se acostumbra a la vida pobre de pablo, pero aqui va ser diferente ya q Maia no le importa los lujos"
3,"Dice tu papá que esto pasará, dice tu mamá que tú me olvidarás... @florentino van 20 años, y el amor sigue intacto y será hasta la muerte"
3,"@Rubiu5 no se si leas esto, pero lo intentaré.Youtuber, escritor, dj y gamer favorito, hoy es mi cumple y sería muy feliz si me saludaras"
3,"las parejas crecen codo a codo y es ahí donde se conoce el verdadero amor, a mi no me hables de humildad que de eso nosotros sabemos bien"
3,"@emejota_qt a mi me pasa todo lo contrario, siempre me dicen ""CÓMO QUE NO HAS VISTO??!!"" y se alejan de mi jajajaja"
3,@judithpaulsen7 @TRICICLODELPERU estas en lo cierto
3,@FireDrgShiRoN De nada por haber ayudado y de paso decir la verdad  Eres la/el mejor No se si eres mujer o hombre Sorry por eso ;_;
3,Siempre recordando buenos momentos #JSG
3,un saludo pa mi brrother crithian de la cruz q conoci en smp el esta recluido en penal no si de lima o provincia buen tipo el muchacho..
3,"Tan rápido Domingo? Yo ni sentí el Viernes. No siento los temblores, los días pasar. Ah, pero ojalá dejara de sentir hambre."
3,"Haces un update con tu pata de intercambio. Te pregunta, entre otras cosas, por tu vida amorosa. Suena ""brillas"" de León Larregui."
3,Siempre ando metida en google buscando imágenes lindas  si me encanta. de lo que sea me gustaría que sean solo para mi pero no se puede
3,y ale le dijo otra vez que estaban ocupados pero más calmada y recién lo capto y se fue. Al final nadie se sentó en esos sitios
3,"No, no soy pilato me refiero a que siempre ando con mis toallas humedad o yo siento que por mis manos la energía positiva entra a mi"
3,"que rapidas son las wikis, en los articulos a su nombre ya le pusieron el ""fue un seiyuu"" y su fecha de defunción"
3,"Poner tu alarma a las 6 am pero recién levantarte a las 8 am, significa algo... Estas muy cansado. Buen día a todos"
3,Y hoy después de tanto tiempo me acorde de ti . Ya no se puede retroceder el tiempo solo caminar pa' lante
3,"@LylaBliggie jajajajaja, ¡qué linda! Yo también me puse re feliz cuando me enteré, nos dejan un álbum antes que TOP se vaya al servicio"
3,Ojeras Y no es porque haya visto un dorama o haya leído un libro en una noche. estaba apunto de dormir y hacen fiesta de largo hasta hoy
3,ah ya entiendo por que tanta rabia se entero que su papá quiere que trabaje con el jajaja que culpa tengo de ser una buena opción
3,"Todos mis días son: -Buenos días Mamita! -Hola hijita 30 min después.. -Chau mamita, nos vemos mañana. -Chau hijita, hasta mañana."
3,Bueno pues ya decidí que iré a Meneo para Halloween y me invitan al día siguiente a 3 master class en el gimnasio a partir de 10 am
3,"@maliux justo vi en Ig que lo tenías y te quería preguntar. Cuando lo hagas, espero el review! Y sí, yo tb tengo varios pendientes"
3,hace mucho no e tenido que ver mi nombre en otras cuentas por que sera? a cierto yo le dije que no lo hiciera Gracias por hacer caso
3,"Qué es el amor decían; pues la respuesta está a quien le preguntas. Todos aman, no con la misma intensidad ni las mismas cosas."
3,"@malditaternura pero hasta ahora se lava la ropa así para q quede blanca eso lo sabemos a los q nos enseñaron a lavar bien, gracias mami"
3,"@fioteca Sí, no sé por qué no me caía para nada que Taylor esté con Ryan y el supuesto activismo de Summer. Extrañaba a Marissa."
3,- Todo lo que quiero por navidad eres tú. - Enserio? - La verdad quiero un iPhone 7 Pero como eres gratis que se puede hacer
3,"Mamá haciendo limpieza  Esto no sirve, esto botalo, etc. Máááá son mis peluches , ya estás grande, acá no hay bebes!"
3,@yanac0895 recordando los viejos tiempos
3,@ContactoRioRoma @YouTube lo mismo opino contactito
3,"A veces tengo ganas de joder y joder por fb, luego recuerdo que ya soy profesional y debo parecer normal, así que se me pasa"
3,"Bueno, mañana es mi examen final de física, el que apruebe determinará si me graduo o no, desenme suerte y enciendan una velita pls"
3,1 de diciembre y la gente tiene una sonrisa en la cara no se si es por el estrés del mes pero igual tienen una sonrisa. #felizdía
3,"Tod@s piensan que los he bloqueado de wtpp pq no pueden ver mi estado ni foto jaja amiguit@s estoy en finales 0 distracciones,lo chento"
3,@Huargo1 me regalaron la mediana
3,"Unos sufren por amor, otro por idiotas, otros(me incluyo) sufren porque se acerca fin de año y no hay dinero para viajar"
3,@musadorada jajaja si claro normal
3,"La felicidad no es un estado en el que podemos permanecer siempre, pero si una actitud que podemos elegir al valorar pequeños momentos"
3,@ICETEX Hola. Soy extranjera y deseo crearme un perfil en su cuenta para acceder a las becas Colombo-Peruanas. Su ayuda por favor Gracias
3,Estamos en #RealPlazaPucallpa junto a @jazminpinedo #FelizmenteEsNavidad
3,Empezamos con los 3 dias de festejos x mi cumple la noche promete..es q cumplir estos años bien vividos hay q celebrarlos como se debe
3,Típico: Te levantas de noche para ir al baño y corres lo más veloz que puedes para que el fantasma no te alcance
3,No #SoyUnicoPorque mi DNI dice que hay 5 personas que se llaman igual okno . Soy único porque soy como soy con mis errores y virtudes
3,@YamileUc pos yo no sabia pensamos que ya se habían ido pero luis vio el mensaje y corrio jaja y yo ni podia seguirle el paso ja
3,"@MexicoFER Obama, Putin, autoridades de Japón y las economías más grandes del mundo están en la ciudad de los reyes, corresponsal LDD"
3,@MelissaPeschier JAJAJAJA No seria nada raro que el que maneje esa combi tenga como chófer a H.Becerril y a M.Mulder como cobrador.
3,"@efecuadros Yo soy tu sangre mi viejo, yooo, soy tu silencio y tu tiempo. Esta canción la cantaba todos los días de chiquita!"
3,"@luquenukem pucha, yo completé el pokedex Perú, solo me faltan los regionales que dudo los consiga y a esperar los legendarios"
3,@HelpDmsOfIdois uno con tyler posey porfavor
3,"@WilssONLY jajajaa sii, aunque acabo en un año comunica y convalido mis 3 años de derecho, sumado a los electicos que iré llevando"
3,"aveces la vida nos sorprende , con buenas cosas y malas cosas pero a mi me esta sorprendiendo con lo que mas quiero"
3,"Bueno, Yixing tuvo pocas líneas como siempre, pero no voy a andar de pesada. Al menos no esta vez"
3,@PaIestina @CDPalestinoSADP @arayamas @mauroabughosh @palestinalibre quiero un polo así
3,"Muy tentada de agarrar el carro, manejar un rato al sur, estar en la playita y luego volver. Pero son la una"
3,Que mensajito alentador me mandaron
3,"Tengo conocidos y familiares que votaron por #Keiko, pero en estos 5 meses la mayoría siente que cometió un error, lo cual me alegra"
3,Que ganas de cagarla y decirle a mis papás que no se quedó donde una amiga si no donde su nuevo novio
3,+ a veces se la pedía prestado se molestó y me la vendió para que no la joda. Ahora ella es la que más la usa
3,Dar gracias y reconocer todo lo que tenemos es el primer paso para tener una vida de plenitud y llena de felicidad. Todo lo demás llegará
3,"@monicaventas hola Monica, tus libros (versión papel) se venden en Perú? Lo tenemos que dar como lectura obligada a nuestros vendedores"
3,".@Taxibeat_Lima hola, envié un correo debido a que mi usuario está supendido. Quisiera me ayuden con el inconveniente. Gracias"
3,"@elsacasas no lo aprendes ni en el cole, ni en la universidad ni haciendo 100 posgrados. O naces o no. Es congénito"
3,fue algo parecido al amor
3,La luna de nuevo #cielodespejado #smp
3,@AnaBelenDoll lo pasaron lindo ayer?
3,Dibujé a Chikorita (mi pokemon fav) y lo malogré con 'mi técnica de pintar con acuarelas'...tmr!
3,"recuerdo que hace 20 kilos decía ""csm, quiero engordar"" 20 kilos después me quedé sin shorts + pantalones quiero ser flaco otra vez"
3,"Queda claro que yo solo vivo para viajar~ No necesito casas ni propiedades, solo necesito boletos de avión y mi mapita"
3,"Gente tuitera, en Cantagallo hace falta voluntarios y donación de pañales, útiles de aseo, leche, frazadas. Sean buenos y si pueden vayan"
3,@richie2492 jajaja claro como olvidarlo!ay ya quisiera pero llego a mi casa a las 10 11pm por mis clases y no puedo ni siquiera ver nada
3,@dbmansilla eso dalo por hecho
3,#CuandoTengoPlata lo gasto todo muy rápido
3,@edelacr7 Ely todo bien? no se nada de ti u.u tengo número nuevo!
3,La fotografía es el medio que te permite reflejar las emociones y conocer a maravillosas personas. Tenlo siempre presente amigo
3,"quiere ser tu luz del día y tu descontrol en la noche mas fría #FanaticaConElTalento sonando @pabloalboran ""la escalera"" @CarlosJRubiofm"
3,Gente juerguera de tuiter (?) algún lugar recomendable donde pongan reggaeton de la old school por la Lima? Si saben recomiéndeme porfa
3,"¡HEY TÚ AMANTE DEL HIP HOP! #enmedios te trae lo mejor Entrevista a Paolo Casaña , nuestro #rapero del día ."
3,@lauritasole Yo una vez le dibujé unos corazones a mi profe de inglés en el examen final. Igual me jaló
3,@SibylCollantes me dejo pensando tu twitt
3,Aquí por lo menos no está solo ELF ... En ese entonces...pfff.... solo estaba Cloud
3,"Gracias canal 35 por la entrevista que hice de #Wake estoy muy contenta, que mañana me voy por muchos piscos jaja"
3,"Amiguitos, yo siempre hablo/escribo de la misma forma, soy bastante cariñoso ... no te estoy gileando, ni quiero algo contigo, sí?"
3,"Y uno que pensaba que no había que hacer, inicio a realizar mi escalonado y mil horas para terminar"
3,"@cineplanet hola, me gustaría saber si van a estrenar en Piura la chica del tren, espero su gentil respuesta, gracias."
3,"@LuzuGames @LuzuVlogs @HelloImLana yo solo quiero saber si tienen mi libreta y los llaveros de llamas que les di son 2, blanca y negra"
3,Es bueno aclarar las cosas
3,"Ma, mira... - Qué? La Paca? Sí, cómo supiste? - Porque es lo único que haces."
3,"@mikkielias estes donde estes quiero que sea feliz, y te quiero ver en la tv SAZÓN MICHELA VUELVE A"
3,Hoy estaré en @RadioLaZonaFM en zona de Humor ups! De Amor 90.5 Fm solo para desearles Feliz Navidad y si quieren les doy una noche buena
3,Saber que hay lugares y sueños infinitos por alcanzar este 2017..... Y empezar a planear como alcanzarlos yaaaaa
3,"Me contaron una historia rara de el significado del uso de anillos de oro, plata, en que dedo y todo... pero lo he olvidado"
3,Hace mucho que tomó buenas decisiones
3,@CaELiKe Y que es muy bueno que alguien hable sobre el tema porque muchos no lo hablan debido a que es un tema considerado Tabu.
3,@unaese esperate que haga caja y te visito tengo planeado que mi 2017 sea un año bien viajero!
3,"Aunque no me crean, yo quiero mucho a @zorrodeabajo y a @unaese. Como diría mi abuela, los montones amontonados. creanmee"
3,mis amiguitos drogos no me hablan
3,@cindy_k20 Es que conseguí una buena chamba hasta el 24 de diciembre y necesito el dinerus ¿Nos vemos después de esa fecha?
3,Extrañar es el peor sentimiento del mundo. Sientes como no puedes hacer nada por estar cerca de quien extrañas.
3,Quiero un pan con salchicha huachana
3,Gripe sal de este puerco trabajador
3,@highoncrackyeol Oh ya bloqueé ese número fácil son marcas porque me dijeron algo de que debía una cuenta de más de 3k$ en el banco wtf
3,He confundido 'concreto' por 'contrato' y 'espacial' por 'especial' en menos de una semana. ¿Qué mierda me pasa?
3,"El día del hombre pasó desapercibido por las mujeres, si fuera al revés no nos perdonan"
3,@AbrahamMateoESP Exacto! Todo lo que él hace lo hace con el corazón y desde el corazón
3,@atvmasnoticias Me parece que Zuckerberg visualiza a Kuczynski como un 'muñequito bailarín' en FB... para indicar cuando estemos felices.
3,Como lidiar con un @#&@%#&-@gerente ....aguanta niña sólo 6semanas +
3,"Hasta luego, Arequipa See you soon (@ Aeropuerto Internacional Alférez Alfredo Rodríguez Ballón (AQP))"
3,@MitsukiAuri Estoy en semana de examenes asi que somos dos
3,Después de 5 días! CREO que mi cronograma de viajes por trabajo ya está listo
3,@memepoliticope mientras q no le rompa la ñata o se la venda pateada...ta bien que se relaje mi tocayo gringo
3,@IsabelArtica vamos a juntos en concierto?
3,@luchinrc en todos nuestros centros comerciales
3,@AndyCamus8 JAJAJAJAJAJA Hola amigo Andy que ha sido de tu vida ya no te dejas ver
3,@AlvaroQGonz pero es verdah pe!
3,Dateame: albañil bueno bonito y barato please. Pintor de fachada y carpintero. Se agradece!
3,"Trataré de ser positiva este último mes, para que no me vaya tan mal como todo el maldito año"
3,"La profesora se pregunta qué pasa con la segurdad jurídica, y yo solo sigo pensando en qué culpa tuvo Fatmagul"
3,"""y recuerda que SIEMPRE mañana será otro día"" palabras de alguien que siempre estará conmigo"
3,Las chicas ya van a salir estoy muy nerviosa y feliz que todo salga bien ⭐
3,@mijacabello97 feliz cumpleaños que sea el mejor cumpleaños de todos muchas bendiciones y muchos éxitos por siempre
