3,"-Me caes muy bien -Tienes que jugar más partidas al lol con Russel y conmigo -Por qué tan Otako, deja de ser otako -Haber si me muero"
0,"user_ref a. que puto mal escribo b. me sigo surrando help 3. ha quedado raro el ""cómetelo"" ahí JAJAJAJA"
0,user_ref risa_ja risa_ja risa_ja risa_ja jajajaja la tuya y la de slang_string mucha gente seguro!! Pero yo no puedo sin mi melena me muero
1,Quiero mogollón a user_ref pero sobretodo por lo rápido que contesta a los wasaps
0,Vale he visto la tia bebiendose su regla y me hs dado muchs grima
1,user_ref user_ref Ah. mucho más por supuesto! solo que lo incluyo. Me habías entendido mal
0,Se ha terminado hash_tag hash_tag #Rio2016 Lamentablemente no arriendo las ganancias al pueblo brasileño por la penuria que les espera Suerte y solidaridad
1,11. siiii fue super gracioso teniamos que habernos sacado una foto
0,user_ref seria mejor que dejasen de emitir esa basura ya hay que evolucionar para bien y eso
0,"user_ref te mandaria a comprarte un burro, pero no creo que hayan tiendas abiertas ahora"
0,Mg y pongo un adjetivo super repelente a vuestro nombre
0,user_ref la voz de María al final me mata JAJAJSJAJAJAJ quilla y yo que
1,user_ref Jaja.Es de bien nacidos ser agradecidos que diría aquel.Tiene el récord de puntos del VCF.Creo que slang_string cumplió con lo que había.
1,"user_ref Bueno, al menos has acabado la noche con una hermosa vista Ami tambien me gusta verlos por la noche ^^"
0,user_ref user_ref enserio cuando habéis dicho que los froot loops están malos me ha dolido...
1,"user_ref Ow Bueno, no pasa nada, cuando puedas confirmarlo, estoy aquí 😊 Y si no pudieras de cosplay pero sí a la expo, +"
1,"Aunque pensaba que no podría hacerlo hasta el mes de octubre, el lunes próximo volveré a ver a mi familia de hash_tag hash_tag #Mataró *.* hash_tag hash_tag #felicidad"
0,Oye user_ref te pones a hablar con user_ref como en los viejos tiempos y no avisas user_ref user_ref
0,"user_ref yo tengo que aguantar int_string int_string 4 niños pequeños, no sé que es peor"
3,user_ref int_string int_string 765 emberda Y porque estoy dedicandome a otros supps últimamente
1,user_ref user_ref hash_tag hash_tag #Incantus Genial ya estoy conectada
2,"Es muy raro el sentimiento que tengo ahora, aunque en fin... Qué más dará"
0,"user_ref user_ref Madrid tiene la cultura propia de los que ""no tiene cultura propia"". Vamos, como los romanos en su tiempo"
0,"Gracias por los ánimos! He dormido un poco más, me he tomado una pastilla y ha bajado a int_string int_string 36 y medio, pero aún me noto rara"
2,"user_ref pues date unas cuantas horas, que es muy temprano"
1,"user_ref user_ref Tienes pinta buena gente por lo que slang_string veo, t he conocio gracias a qt"
1,"user_ref ... bueno, desierta, desierta, no, con algunos seres feéricos"
0,user_ref int_string int_string 2 horas esperando en Comisaría Gandia y han atendido a int_string int_string 3 personas! Y solamente para una autorización de viaje a un menor.
0,"user_ref user_ref No he visto su DNI o Pasaporte pero presume de serlo aunque es muy,demasiado,peculiar y poco caritativa"
0,user_ref Oh ¿Me estás llamando gordo? JAJAJA Grazie ruliño Lo mismo puedo decir
1,user_ref Tú siempre sexy Nerea!! Qué tengas un maravilloso día! Besitos!
1,user_ref hash_tag hash_tag #seestrenasietevidas Sería un gato tipo Garfield porqué soy un poco vago y porqué me encanta la lasaña!!
0,user_ref user_ref Si es que odio a muerte a la nueva Harley que quieres
0,user_ref ni tu como soportas el calor sevillano hija mía
3,"user_ref user_ref +10000, cremos una agencia de contratación de temporales, a ver cómo se vende a los sindicatos"
0,.@soyalt_es estaremos atentas a las novedades futuras. ¡El final del verano no será igual sin vosotros!
0,Ayer me quedé dormido xdddd lo peor esque sigo reventado
0,"Confirmao tengo el pie roto, he notado como el puto hueso se movía"
1,"user_ref muchísimas gracias Luis Tú también eres un ejemplo de constancia y buen trabajo, espero que os vaya todo genial!"
0,Tengo una adicción muy seria al burguer King necesito ayuda profesional
0,"Me dice un pajarito que ahora mismo no puede reservar en la web de BiBo, lo nuevo de user_ref Espero que sea por la demanda."
1,user_ref A ti por responder! Espero y deseo que te salgan nuevos proyectos!! Besitos!!
3,user_ref user_ref user_ref user_ref user_ref oye corsa que yo no he jugado contra puni en lan
1,Estoy preparando muchas cosas para que el especial sea muy especial
2,"Solo porque UNA persona diga que me conoce y opine sobre cómo soy, y convenza a otra de ello no significa que sea así"
3,"user_ref porque no vives en Madrid!! bueno yo estoy ahorrando, yo lo intento jo y si no pues en la cola y ya quedaremos a parte.."
0,"user_ref user_ref user_ref Eso me temo, mucho calor y mucha gente por todos lados, lo malo de viajar en agosto"
0,"user_ref Pues si no fichan ""lo que sea"" además de un ridículo espantoso igual QSF nos deja plantados...esperemos que no"
3,user_ref cuando estén los int_string int_string 20 contactados y aprobados se publicará el listado en nuestra web
1,"user_ref Te la recomiendo, parece monótona pero hay capítulos que vuelven a subir el interés"
0,Ya no tengo capítulos de Juego de Tronos para ver. Me siento vacía.
1,"user_ref risa_ja risa_ja risa_ja risa_ja Jajaja se aprovechó lo ke pudo, ya se fue a currar pero mañana descansa mucho lío entonces no? Y con el malagueño que tal?"
1,user_ref solo recuerda que Iman es tranquila
3,"user_ref en el debate que he estado leyendo, en el blog de Silvio user_ref lo pone el gran user_ref citando al Che."
2,"comprendo que te molen mis tattoos, pero no te los hagas 'iguales'"
3,user_ref user_ref para cometer atentados terroristas (2) No creo que entonces existiera el burkini
3,user_ref pues necesito un audio para el próximo episodio ¿te animas?
0,user_ref risa_ja risa_ja risa_ja risa_ja jajajaja... eso es verdad... aquí no hay uno cuerdo
1,user_ref user_ref Un lapsus advertido gracias a user_ref y subsanado. Gracias por tu aportación.
0,user_ref Lo feo es llegar al reina sofía y que los descuentos de estudiante sean para menores de int_string int_string 27 años
2,user_ref el resto puedo dudar pero de ese grupo lo tengo claro
1,user_ref hay gente muy buena trabajando duro en user_ref Palabras así impulsan user_ref
0,"Ah vale, me suelta la puta subnormal, te estoy llamando. Le digo que no me sale y dice ""ah, es que tengo el wifi apagado"""
2,user_ref espero y deseo que el interior te cause lo mismo
0,"user_ref Pues espero que no lo digas por mi niña o no voto mas memeo, bueno cada uno tendra su opinion +"
3,user_ref user_ref pregunta seria. para cuando kedada/cañas de gente twittera de la zona?
1,"user_ref Yo cuando pueda quiero tener el Omega Constellation,, con los numéricos romanos."
0,user_ref es grasioso porque en vez de aspirar a ser alcalde aspiras a concejal...
0,Hoy quiero hacer otro juego de estos de tw pero esque son todos iguales
3,"user_ref Que tampoco ahora mayoría absoluta, eh?"
0,Por desgracia el sorteo que tenía pensado hacer es sólo para gente de Europa Ya haré más sorteos para todo el mundo!
0,"user_ref Qué fácil es quedarse calladito, bajarse los pantalones y no decir ni mú... Cuánta ignorancia en tu ""opinión"". Saludos"
0,Yo Me cago En los muertos De todas Las bacterias malignas De mi Garganta .
0,user_ref la próxima vez que vaya a Madrid no estarás en mis planes. Maldita
1,"user_ref Totalmente. Aunque la post-tertulia ha sido muy interesante, hablando de todo esto, y la evolución (e involuciones) del cine"
1,"user_ref Pues tan sencillo porque en su día me puse a hacerlo y es de lo que mas encargos me hacen, aparte tengo mas estilos crack"
1,user_ref no había parada pero he visto una rotonda mu bonica en la que ponía Nules
0,"user_ref abandoné mi tierra y llegué justo ayer a España, estoy sensible, te odio"
0,"Ahora que estoy en Madrid casi no puedo hacer fotos chachis, solo a mi careto y no"
0,user_ref Ps que las exterminen. Por mi salud mental (y pa que pueda dejar de hacer el ridículo por la calle risa_ja risa_ja risa_ja risa_ja jajajaj)
0,"user_ref user_ref Lo de prohibir el casco e ir enmascarado también es arbitrario y sectario, no?"
1,user_ref Ya lo tenía fichado y tengo ganas de darle uso ¡¡Gracias!!
3,user_ref buenas tardes! Se puede pasar?
3,user_ref ¡Pero explicar a fondo las zonas habitables y que condiciones necesita un planeta para serlo!
1,"user_ref no sé si hubo más gente, pero ayer te tagueé yo ayy, Hannibal es que moooooola tanto!"
0,hash_tag hash_tag #Otegi inhabilitado hash_tag hash_tag #EsLaSentencia Mujeres tapadas hasta los ojos hash_tag hash_tag #EsSuCultura Teneis un sentido inamovible del mundo y de la vida.
1,"user_ref ay, gracias. Lo malo es que ese es solo para primer viaje. Pero mil gracias igualmente"
0,"Madrid está lleno de comida y crushes, no me llevéis de aquí"
0,user_ref user_ref user_ref los reyes magos son mas reales que este
2,"Es worth para coger el bonus, pero es mucho más divertido luchar"
0,"user_ref user_ref user_ref más bien tas tenía aprecio por raistlin, yo creo que al mago le daba un poco igual todo"
1,"user_ref Gracias ya me pasó una vez y los antibióticos fueron milagrosos, estoy deseando que vuelva mi madre con ellos"
0,user_ref quiero un Linoone con Tambor y Velocidad Extrema pero es de esos especiales de generaciones pasadas que ya no se puede
2,"user_ref 27. Parece que las cosas no te van muy bien, espero que todo mejore, que todo el mundo merece ser feliz"
1,user_ref user_ref los dos amigos menos quejicas que tengo
1,user_ref user_ref user_ref ¡¡Nos sumamos a la felicitación a un grande!!
2,"Eso sí, demasiada sobredosis de guiños, cameos, homenajes, frases y planos repetidos de la original. Pero bueno, se acepta"
2,"user_ref venga jimbre, lo que debes haver es hacerte cadista"
1,Dio tener un perro es la ilusión de mi puta vida
0,user_ref Muy mal!!! risa_ja risa_ja risa_ja risa_ja jajaja mas Geralt de rivia y menos juego de tronos
1,Por qué me gusta más tu personalidad que cualquier espalda ancha
0,user_ref Mirate De slang_string gray-man desde cero puta
2,"user_ref Por supuesto, en el Mercadona. Hombre, encima que soy crush de alguien"
0,hay alguien apuntando a mi ventana con un laser define pesadito
0,user_ref Me apena que haya pasado esto porque la idea de crear un colectivo estatal con divisiones locales era algo poderoso
0,"odio a lucia la vd, mi amor hacia ella es una gran tapadera pa comer nutella en su casa"
0,No entiendo de verdad porque la gente cree que en realidad me la suda
2,user_ref user_ref user_ref user_ref ese es Seve que se pone exquisito. Yo más de andar por casa (menos florida)
0,"Llevo como una hora repitiendo ""No debí haber bebido ese último Monster"" teniendo que madrugar Mi vida."
2,"user_ref . Estas palabras, del Poema, INSTANTES, son de Nadine Stair. Escritora norteamericana, a la que slang_string le gustan los helados."
2,preparándome un colacao pa olvidarme de aquel bacalao...
1,gracioso bc en la película de Nunca apagues la luz utilizan luz negra y hoy he llegado a casa y han puesto uno en el baño
0,nos lo habíamos encontrado y estaba asustado cruzando una carretera y al final nos hemos tenido que marchar sin él.
1,"user_ref si al final acabamos hablando un rato, era muy simpática user_ref"
3,user_ref tío peguemos al Lau Sigues teniendo mi primer grinder?
1,Este año el Madrid hará triplete y si lo hace me rapo al cero grabad el mensaje risa_je risa_je jejej hash_tag hash_tag #ChiringuitoPiqué
1,user_ref Mis sentimientos y mi orgullo por el Valencia son muy grandes. Yo quiero lo mejor para el Valencia.
3,"user_ref user_ref me quedo con lo primer ""un pensamiento en un clic"""
1,user_ref y sentimos empatia hacia cualquier ser vivo sin distinción
0,Gracias tormenta por aparecer justo cuando me voy a meter en cama solita
1,user_ref pues pocas cosas más bonitas puedes ver en la vida oye
1,"user_ref qué hermoso!,es bueno desviar la mirada al cielo y a las nubes de vez en cuando,abajo está jodido.preciosa foto,mil abrazos"
0,user_ref en la vida puede verseme una teta porque cuando me eche la foto no estaba desnuda
1,"user_ref Ya, ya. El edificio A sí, el edificio B no. Facilísimo de articular"
2,Mañana es muy probablee que caiga un directo!! Y ya sabeis lo que pasa en los directos...
2,user_ref el club de la comedia se ha quedado demasiado grande hash_tag hash_tag #monologuista Jaja
1,"Lamento decirles que ya no soy calvo, mi calva perfecta se ve opacada por mi pelo"
0,user_ref ya pero no soy mucho de pc. No es muy potente el mío
3,"user_ref user_ref user_ref user_ref user_ref user_ref user_ref hola miguel no,ahora estoy en ella"
3,Nominada por user_ref Aquí van nuestras pelis y nuestros taggeados. hyp_link
0,Ya me está jodiendo la tarde Pep...bueno me.voy a dar un.paseo
0,"user_ref Prohibirlo, no. Se pueden hacer campañas, pedagogía... y no aplaudir como están haciendo muchas pseudo-feministas user_ref"
0,user_ref pues sabran més que slang_string jo *curso CCC de mirones y mironas
1,"He puesto la radio solo pa escucharle risa_ja risa_ja risa_ja risa_ja jajajajajajaja ai, que ganas de verle ya ostia"
0,user_ref TOTALMENTE Pobre Gappy... que inocente es no sabe con quien se ha encontrado.
1,"user_ref 2. Hace mucho tiempo hablabamos por skype por un amigo en común y estaba guay, además de que eres muy mona!"
1,"Buen partido a todos user_ref , suerte en la final de losers y a ver si nos volvemos a ver en la gran final. Saludo a esos casters"
0,user_ref user_ref Un capullo menos en el Valencia. Si no esta al 100% con el Valencia lo mejor es venderlo.
2,user_ref hombre me dices que se oía mal yo soy defensora de Amaiah a morir JAJAJ
0,"Quiero que vuelva el invierno y ponerme pantalones largos y chaquetas y sudaderas y abrigos, puto verano."
1,Pensar en irse pronto a la cama y ver que dan int_string int_string 2 capítulos de hash_tag hash_tag #minorityreport la mejor manera de alegrarse la noche
0,"user_ref somos el PACMA, a todos caemos bien pero nadie nos quiere. Lloremos juntos"
0,Cuando sufres porque no encuentras emulador para jugar al pokemon rubí en iOS 9.3.4
3,user_ref user_ref user_ref convenciendo a mi hija mayor para verlo
0,user_ref no queda ni un país árabe laico... Hasta con Argelia y Tunez están acabando
2,Estoy muy nerviosa por el partido
0,"user_ref Intentan salvar a Lincoln como Julián con Lorca... Aparte de que es una copia descarada de MdT, no se parecen en nada"
0,"user_ref porque somos de Móstoles, salir de nuestro ambiente es difícil"
0,ola wapa k tal stas?? spero k no seas una sorra kmo las otras xikas - machirulo QUÉ COJONES JAJSAKJKJSADJJSJASJAJAJA
1,user_ref pues ahí lo tienes. Si tú no huyes entonces eres una luchadora y no una cobarde no?
0,Es conveniente tener un Gobierno democrático que cumpla su función politica. NO lo es tener un Gobierno que representa la hash_tag hash_tag #corrupciónPP
0,user_ref user_ref los salidos son los que slang_string suben cosas a esa página no yo
0,"otra noche hasta las int_string int_string 4 de la mañana despierta, aburrida y sin sueño, lo veo venir..."
3,user_ref me lo apunto en la lista de cosas posibles de hacer
0,"user_ref esta no es, le tienes que dar a US Store, solo se vende en US y Canadá por ahora claro."
0,Es triste que casi todas mis series acabadas hayan sido porque las han cancelado
1,user_ref user_ref Nop. Pero ahora me queda más claro el asunto Gracias !
2,Sólo quería hablar con gente en verda
3,como entraba una conversación de estas largas de hablar toda la noche con alguien
3,user_ref user_ref O ponerte un casco de moto que te cubra por entero
3,"Hey, user_ref que me dice Amazon que ""Todas las bodas necesitan un plan B"" ya está cargado en mi Kindle. ¿Empiezo ya o qué?"
1,"user_ref user_ref Tras 72.000 años de viaje, conformate con que haya moléculas de Potasio y estén buenas"
1,user_ref no creas. Pero me gusta tener a la gente engañada user_ref
0,Tú que he ido a cenar a mar de cristal y me he inflado y me duele la barriga
0,"Mira que soy pesimista a maza, pero odio que la gente sea TAAAAN pesimista"
1,"user_ref risa_ja risa_ja risa_ja risa_ja Jajajaja en cuanto salga de mi bucle infinito con la casa, me imprimo los mapas a dos y lo estreno!!"
0,"user_ref yo me resigno con alguna gente, si se creen a este personaje es porque no están dispuestos a escuchar"
2,"user_ref El concepto es de lo más bonico, pero de eso a serlo hay un trecho"
0,"Voy a estar unos días desaparecida, me estoy quedando sin gigas risa_ja risa_ja risa_ja risa_ja jajajja que slang_string vida + triste !!! Me voy al parque con los perros.."
0,Tener las piernas llenas de picaduras de mosquitos que parecen heridas NO ME HACE GRACIA.
3,user_ref se llama saber cual es la mejor forma de crear estructuras que aguanten ese peso
1,"user_ref Enhorabuena por los geniales resultados económicos de récord del trimestre pasado, hacéis un gran trabajo"
0,Hay una exposición de cuadros y uno de ellos está estropeandose por el agua del aire acondicionado que le cae encima
0,"user_ref Tio entonces piensas que mosca es un insulto, yo creo que eso es un poco irrespetuoso a las pobres"
2,user_ref Para los chicos es mil veces más fácil donar que para las chicas
0,lo malo es que faltaba su mid y acabaron haciendo remake
1,user_ref user_ref La noticia perfecta para hash_tag hash_tag #NotasDelMisterio
1,Hoy toca escuchar a hash_tag hash_tag #MiguelRios con otros grandes artistas... hash_tag hash_tag #Insurrección...
3,El Espanyol interesado en Aktí Mel para reforzar su defensa esta temporada. Llegaría por int_string int_string 2 millones del L-Casei Imunitas griego
1,"user_ref Perdóname la maldad, Julio, que sabes que slang_string te quiero, pero borrándose del AMI se combate al menos a los separatas"
3,user_ref user_ref pues me da igual yo escribo lo que pienso ^^ y cuando lo pienso risa_ja risa_ja risa_ja risa_ja ajajaj si es que lo pienso
1,"user_ref user_ref user_ref Si hay que pecar de algo, que sea de ser buena gente!"
1,"user_ref me quedo tranquilo entonces, pero iré mirando la opción del coche"
0,Mi puto novio me ignora y quiero saber si hay un chino cerca de la biblioteca
0,He salido de casa sin ir al baño y me estoy meando como una persona mayor
0,"user_ref user_ref sí, lo he leído ese templo grande es el que he puesto en IG. Ha perdido su parte superior y está inaccesible"
0,"user_ref Así me gusta, cada cosa a su CCAA. Así dejamos de cargar las culpas a nuestra querida nación."
0,"user_ref pues yo no hay manera, y eso que tengo recuerdo lejano y de stats tengo una media de 69-70"
0,"user_ref user_ref user_ref user_ref user_ref user_ref user_ref user_ref Vamos mal, no... peor"
2,"user_ref aaahm bueno, disfruta la vida por esos lares, yo me vuelvo a Rusia en breve"
0,Silvia pesada deja de dar rt que me sale doble notificación
2,"user_ref user_ref user_ref user_ref ""Resultad Sobrevives"" lo de estar loco funciona"
0,"user_ref pero nos hemos desmovilizado, Concha. Nosotros/as solas dejamos las calles. Así nos va user_ref"
2,"Me he agobiado muchísimo porque no encontraba a mis amigos en el Bar, luego he recordado que no tengo amigos y me he puesto feliz"
0,en realidá é algo duro de asimilar ni el alcohol me ayuda
0,user_ref los ábacos si están permitidos. Sobre todo porque la mayoría no saben usarlo
1,user_ref user_ref user_ref ohhhhh eso tiene que ser muy divertido me imagino que los hombres están vetados no?😀😀😀
1,tio os quiero mil a los que me habéis hablado
0,user_ref en realidad es hipócrita todo eso como la camiseta esa de femimism del hym pero creo que en la vida cotidiana algo hace
0,"Había un hombre en la calle. Estornudó y yo desde la ventana le he dicho ""salud"" Me miró mal y siguió caminando"
0,"Me veis en persona, no me saludais y luego me hablais para decirme que me habeis visto"
1,"user_ref si es que no puedo olvidar cuando te viii, imposible. Que resumiendo, no te puedo olvidar y no lo haré jamás chiqui ❣️💞"
1,"user_ref En las carreras es al revé a más interés, más coches ... pero tú mismo lo dices, es una empresa, aunque se venda ..."
0,user_ref estoy total y absolutamente desesperanzada user_ref
1,"user_ref Bien bien, si estan celebrando un cumpleaños, si todos nacieron el mismo dia hahahahahahha al menos son dos capítulos"
0,"user_ref cucha, una independentista escribiendo en español!! Por muy del Barça que soy, te vas a buscar la vida grassias."
0,Porque son tan manipulables los pequeños ? Y porque no ven a su padre igual que a su madre ? Triste
1,user_ref Muy chulas esas gafas Paula Y lo de guapa es talento innato tuyo :
3,"user_ref user_ref dicen que tira pa, san Mateo ahora Jaaja"
1,Esta tarde me voy a comprar un juego que estuve esperando muchísimo tiempo... posiblemente lo suba esta tarde-noche Yoshi aparece
0,"Qué depresión me entra, de seguro gana gente que solo dio RT porque sí, por probar suerte y no verdaderos fans"
1,"Gracias Victorerubio por recomendarme el seguimiento de user_ref Artistas de talla internacional, monólogos y musica en directo"
1,user_ref Muy sexy Sabrina! Besitos y feliz día!
0,user_ref risa_ja risa_ja risa_ja risa_ja jajajaja.... eso es una indirecta preparate hash_tag hash_tag #F que quiere reformar el baño
1,WORK FROM HOME!! Sería espectacular y poder verlas más! hash_tag hash_tag #ConMTVal727Tour
0,"Esta bien tener hermanos, siempre y cuando uno de ellos no decida ser subnormal perdido"
1,user_ref user_ref doble sub-campeón de Europa algo es algo risa_ja risa_ja risa_ja risa_ja jaja
1,user_ref user_ref user_ref user_ref Ole los buenos almerienses!!!! Mil besitos!!!!
3,user_ref ahora tengo un dilema. Ayúdame Toni Y en 3DS porque me salió a int_string int_string 25 euros nuevo hyp_link
2,lo mejor es que son conversaciones normales y corrientes sin ningún ánimo de ligar pero simplemente porque no se ligar
1,user_ref user_ref y otros biólogos como él se sentirán complacidos. ¡Mola mucho!
1,"Estás haciendo MUY feliz a todo mi tl,yo también quiero que me sigas user_ref"
1,"user_ref gracias, ya eran necesarias tras un duro año de trabajo ¿has cogido tú ya?"
0,"user_ref ay, joder, que resulta que es completamente vegana. Pues ya no me la compro."
0,user_ref Para cuando me escribes mi nombre bien precioso
0,"user_ref yo no tengo ni idea y soy la primera que dice ""tiempo reglamentario"" pero en su día me convencieron de que estaba mal dicho."
3,"user_ref user_ref El tuit va acompañado de una foto que quiere decir lo contrario, SÍ es sarcasmo"
0,"user_ref un click más, scroll y a veces el usuario se queda un poco colgado sin saber bien lo que tiene que hacer"
0,"user_ref user_ref user_ref user_ref user_ref Muy triste, pero no olvidemos la inestimable colaboración del estado en ello"
0,user_ref el rottweiler es precioso pero... Esta zumbadisimo y ataca y yo muero de ganas de achucharlo
0,user_ref user_ref te lleguen a entender y a respetar. Muy malos tienen que ser para obligarte a comer algo a la fuerza
0,"Si es que llegáis aquí desde mi Favstar del cretácico y claro, luego no me duráis ni un suspiro. Que mis neuronas no son como antes, jopé"
1,user_ref Hola bella Andrea!! Qué tengas un maravilloso día!! Besitos!
0,En fin estoy más sola que la una viendo como una bollera duerme y esperando como un perrito pa que slang_string me saquen a pasear
0,"user_ref yo los vi en el Low cost de hace int_string int_string 3 años y me decepcionaron, aunque dicen que lo mismo hacen una cagada o son la hostia"
1,user_ref esta vez me decanto por la japonesa. P. Me encanta la batalla de caratulas
3,user_ref michael jackson tambien y la gente canta sus canciones
2,user_ref podrías solidarizarte conmigo y no comer ninguno...
1,user_ref user_ref user_ref user_ref user_ref Gracias pero los importantes sois vosotros. Los mediadores. Sois muy buenos
3,Volviendo a la actividad en hash_tag hash_tag #PlanetaInquietante con otro curioso hallazgo en Canelas. hash_tag hash_tag #Portonovo
1,"user_ref bien dicho Roberto, las cosas por su nombre, porque nadie dice cola cado"
0,me acaba de seguir una página para ligar por gustos musicales. sé que estoy sola pero
1,Tengo una hermana que con ella no me puedo aburrir risa_ja risa_ja risa_ja risa_ja jaja creo que todas las gilipolleces las ha aprendido de mí. Es como una segunda Nicky
1,user_ref estarás super mona cuando pueda lo miraré yo también. Me molaría grupal de 'chicas Spidey'
2,"user_ref ¿haces también la misma carrera? Jo, igual de una comunidad a otra cambian, be positive"
0,user_ref yo es que me asustó muy fácil con el rollo paranormal
0,"user_ref pues descansa tío, si se pone grave la cosa no podrás jugar en muchísimo tiempo"
0,user_ref user_ref user_ref user_ref user_ref n escarmentams a ver si van a ser mismas encueshshtasshs eh user_ref
0,Sara piensa que slang_string vivo rayada xq me duermo escuchando a beret y weno
1,yo con un mensaje de buenos días y un corazón soy feliz
1,user_ref user_ref user_ref user_ref así es compañera. Un fuerte abrazo!
1,user_ref Y tú tan estupenda como siempre!! Besitos y feliz día!!
1,al menos con ftwd se me hace más ameno esperar a twd en Octubre
0,user_ref qué burrada pusieron hoy?? Que llevo meses bloqueada por otra heterada y me lo perdí
3,user_ref hace una semana que se sabe yo ya espero la edicion completa del juego
2,user_ref user_ref pues si eso haré.. y lo sigo haciendo ya que haga lo que quiera. No pasa nada.
0,"es que todos los que dicen que los que escuchamos a ""los gemeliers"" somos adolescentes de mierda son los primeros adolescentes de mierda"
0,Hay videos que no se envían porque no tengo espacio en el móvil así que lo siento
0,2h y 31m para que acabe tu descarga Me cago en mi puta vida.
1,"user_ref no te había reconocido en este perfil El placer es mutuo, guapa!"
